id,title,description,availability,condition,price,link,image_link,brand,item_group_id
66894812,7' PURSUIT SHORT - UNLINED- Black,7' PURSUIT SHORT - UNLINED- Black,out of stock,new,0.00 USD,7-pursuit-short-unlined-black,https://cdn.shoplightspeed.com/shops/651012/files/70056745/screen-shot-2024-06-10-at-93225-pm.png,,66894812
66894809,Commuter Short Sleeve Button Down- Blue,Commuter Short Sleeve Button Down- Blue,in stock,new,0.00 USD,commuter-short-sleeve-button-down-blue,https://cdn.shoplightspeed.com/shops/651012/files/70056741/screen-shot-2024-05-29-at-52656-pm.png,,66894809
66894806,7' COMMUTER SHORT- Iron,7' COMMUTER SHORT- Iron,in stock,new,0.00 USD,7-commuter-short-iron,https://cdn.shoplightspeed.com/shops/651012/files/70056737/screen-shot-2024-06-10-at-91318-pm.png,,66894806
66894805,7' COMMUTER SHORT- Black,7' COMMUTER SHORT- Black,in stock,new,0.00 USD,7-commuter-short-black,https://cdn.shoplightspeed.com/shops/651012/files/70056733/screen-shot-2024-06-10-at-91142-pm.png,,66894805
66894800,7.5' R&R TRUNK- CROSS STITCH STRIPE,7.5' R&R TRUNK- CROSS STITCH STRIPE,in stock,new,0.00 USD,75-r-r-trunk-cross-stitch-stripe,https://cdn.shoplightspeed.com/shops/651012/files/70056719/screen-shot-2024-05-29-at-62609-pm.png,,66894800
66894795,7' PURSUIT SHORT - UNLINED- ASPHALT,7' PURSUIT SHORT - UNLINED- ASPHALT,in stock,new,0.00 USD,7-pursuit-short-unlined-asphalt,https://cdn.shoplightspeed.com/shops/651012/files/70056705/screen-shot-2024-05-29-at-61943-pm.png,,66894795
66894792,TOP FLIGHT VEST- SLEET GRAY,TOP FLIGHT VEST- SLEET GRAY,out of stock,new,0.00 USD,top-flight-vest-sleet-gray,https://cdn.shoplightspeed.com/shops/651012/files/70056699/screen-shot-2024-05-29-at-61122-pm.png,,66894792
66894786,9' MOMENTUM GOLF SHORT- Blue Stone,9' MOMENTUM GOLF SHORT- Blue Stone,in stock,new,0.00 USD,9-momentum-golf-short-blue-stone,https://cdn.shoplightspeed.com/shops/651012/files/70056690/screen-shot-2024-05-29-at-60742-pm.png,,66894786
66894785,7' COMMUTER SHORT- Navy,7' COMMUTER SHORT- Navy,out of stock,new,0.00 USD,7-commuter-short-navy,https://cdn.shoplightspeed.com/shops/651012/files/70056684/screen-shot-2024-05-29-at-60402-pm.png,,66894785
66894782,Dealmaker Pants- Cypress,Dealmaker Pants- Cypress,in stock,new,0.00 USD,dealmaker-pants-cypress,https://cdn.shoplightspeed.com/shops/651012/files/70056675/screen-shot-2024-05-28-at-102525-pm.png,,66894782
66894777,ss sunwashed henley- heather grey,ss sunwashed henley- heather grey,in stock,new,0.00 USD,ss-sunwashed-henley-heather-grey,https://cdn.shoplightspeed.com/shops/651012/files/70090791/screenshot-2025-05-02-at-85805pm.png,,66894777
66894774,Mick Tee- true black,Mick Tee- true black,in stock,new,0.00 USD,mick-tee-true-black,https://cdn.shoplightspeed.com/shops/651012/files/70056669/screen-shot-2024-05-21-at-55910-pm.png,,66894774
66894773,Tommy structured fleece hooded sweatshirt- sand dune,Tommy structured fleece hooded sweatshirt- sand dune,in stock,new,0.00 USD,tommy-structured-fleece-hooded-sweatshirt-sand-dun,https://cdn.shoplightspeed.com/shops/651012/files/70056666/screen-shot-2024-05-21-at-54839-pm.png,,66894773
66894766,REC FLC TAPERED SWEATPANT- Black,REC FLC TAPERED SWEATPANT- Black,in stock,new,0.00 USD,rec-flc-tapered-sweatpant-black,https://cdn.shoplightspeed.com/shops/651012/files/70056652/screen-shot-2024-05-20-at-95751-pm.png,,66894766
66894763,Pivotal Performance Short- Graphite,Pivotal Performance Short- Graphite,in stock,new,0.00 USD,pivotal-performance-short-graphite,https://cdn.shoplightspeed.com/shops/651012/files/70090682/screenshot-2025-05-02-at-84957pm.png,,66894763
66894762,EVERY BODY ZIP FRONT HOODIE- Fresh Snow,EVERY BODY ZIP FRONT HOODIE- Fresh Snow,in stock,new,0.00 USD,every-body-zip-front-hoodie-fresh-snow,https://cdn.shoplightspeed.com/shops/651012/files/70056645/screen-shot-2024-02-26-at-20553-pm.png,,66894762
66894760,PIVOTAL PERFORMANCE LINED SHORT- CERULEAN NAVY,PIVOTAL PERFORMANCE LINED SHORT- CERULEAN NAVY,in stock,new,0.00 USD,pivotal-performance-lined-short-cerulean-navy,https://cdn.shoplightspeed.com/shops/651012/files/70090713/screenshot-2025-05-02-at-85116pm.png,,66894760
66894749,REC FLC SWEATSHIRT- mineral moonlit ocean,REC FLC SWEATSHIRT- mineral moonlit ocean,in stock,new,0.00 USD,rec-flc-sweatshirt-mineral-moonlit-ocean,https://cdn.shoplightspeed.com/shops/651012/files/70056635/screen-shot-2024-05-20-at-100553-pm.png,,66894749
66894747,"beacon trunk (7"")- fish scale batik","beacon trunk (7"")- fish scale batik",in stock,new,0.00 USD,beacon-trunk-7-fish-scale-batik,https://cdn.shoplightspeed.com/shops/651012/files/70056629/screen-shot-2024-06-18-at-90621-pm.png,,66894747
66894743,movement quarter zip- mountain grey feeder stripe,movement quarter zip- mountain grey feeder stripe,in stock,new,0.00 USD,movement-quarter-zip-mountain-grey-feeder-stripe,https://cdn.shoplightspeed.com/shops/651012/files/70056628/screen-shot-2024-05-28-at-92935-pm.png,,66894743
66894739,WOODLAND SCUBA FULL ZIP- Black,WOODLAND SCUBA FULL ZIP- Black,in stock,new,0.00 USD,woodland-scuba-full-zip-black,https://cdn.shoplightspeed.com/shops/651012/files/70056613/screen-shot-2024-06-21-at-31550-pm.png,,66894739
66894735,TOP FLIGHT VEST- Asphalt,TOP FLIGHT VEST- Asphalt,out of stock,new,0.00 USD,top-flight-vest-asphalt,https://cdn.shoplightspeed.com/shops/651012/files/70056603/topflightvest-asphalt-0003-900x.webp,,66894735
66894734,Go-to Polo- Stone,Go-to Polo- Stone,in stock,new,0.00 USD,go-to-polo-stone,https://cdn.shoplightspeed.com/shops/651012/files/70056602/screen-shot-2024-05-28-at-101151-pm.png,,66894734
66894733,Go-to Polo- Heather Silver Spoon,Go-to Polo- Heather Silver Spoon,in stock,new,0.00 USD,go-to-polo-heather-silver-spoon,https://cdn.shoplightspeed.com/shops/651012/files/70056600/screen-shot-2024-05-28-at-100931-pm.png,,66894733
66894727,Pique Tee Dress- White,Pique Tee Dress- White,in stock,new,0.00 USD,pique-tee-dress-white,https://cdn.shoplightspeed.com/shops/651012/files/70056595/screen-shot-2024-06-28-at-102308-am.png,,66894727
66894723,Pique Tee- Heather Grey,Pique Tee- Heather Grey,in stock,new,0.00 USD,pique-tee-heather-grey,https://cdn.shoplightspeed.com/shops/651012/files/70056583/screen-shot-2024-06-28-at-102651-am.png,,66894723
66894714,Pique Tee- Jet Black,Pique Tee- Jet Black,in stock,new,0.00 USD,pique-tee-jet-black,https://cdn.shoplightspeed.com/shops/651012/files/70056575/screen-shot-2024-06-28-at-103006-am.png,,66894714
66894711,Pique Tee- Navy,Pique Tee- Navy,in stock,new,0.00 USD,pique-tee-navy,https://cdn.shoplightspeed.com/shops/651012/files/70056569/screen-shot-2024-06-28-at-103220-am.png,,66894711
66894710,TREK SHIRT- CARBON/BLACK BUFFALO PLAID,TREK SHIRT- CARBON/BLACK BUFFALO PLAID,in stock,new,0.00 USD,trek-shirt-carbon-black-buffalo-plaid,https://cdn.shoplightspeed.com/shops/651012/files/70056566/screen-shot-2024-07-05-at-115118-am.png,,66894710
66894704,7' INVICTUS RIPSTOP SHORT - UNLINED- OLIVINE,7' INVICTUS RIPSTOP SHORT - UNLINED- OLIVINE,in stock,new,0.00 USD,7-invictus-ripstop-short-unlined-olivine,https://cdn.shoplightspeed.com/shops/651012/files/70056559/screen-shot-2024-07-21-at-32116-pm.png,,66894704
66894696,GOLF SPORT POLO- SEAGRASS GREEN,GOLF SPORT POLO- SEAGRASS GREEN,in stock,new,0.00 USD,golf-sport-polo-seagrass-green,https://cdn.shoplightspeed.com/shops/651012/files/70056549/screen-shot-2024-07-21-at-33438-pm.png,,66894696
66894689,INVICTUS RIPSTOP ANORAK- Black,INVICTUS RIPSTOP ANORAK- Black,in stock,new,0.00 USD,invictus-ripstop-anorak-black,https://cdn.shoplightspeed.com/shops/651012/files/70056539/screen-shot-2024-07-21-at-33833-pm.png,,66894689
66894685,Go-to Henley Short Sleeve- HEATHER SILVER SPOON,Go-to Henley Short Sleeve- HEATHER SILVER SPOON,in stock,new,0.00 USD,go-to-henley-short-sleeve-heather-silver-spoon,https://cdn.shoplightspeed.com/shops/651012/files/70056525/screen-shot-2024-07-22-at-75838-am.png,,66894685
66894682,Go-to Henley- Black,Go-to Henley- Black,in stock,new,0.00 USD,go-to-henley-black,https://cdn.shoplightspeed.com/shops/651012/files/70056516/screen-shot-2024-07-24-at-120433-pm.png,,66894682
66894679,Stretch Terry 5-Pocket Pant- Stone,Stretch Terry 5-Pocket Pant- Stone,in stock,new,0.00 USD,stretch-terry-5-pocket-pant-stone,https://cdn.shoplightspeed.com/shops/651012/files/70056512/screen-shot-2024-07-28-at-80620-pm.png,,66894679
66894676,Go-to Henley- Heather Charcoal,Go-to Henley- Heather Charcoal,in stock,new,0.00 USD,go-to-henley-heather-charcoal,https://cdn.shoplightspeed.com/shops/651012/files/70056502/screen-shot-2024-08-10-at-24907-pm.png,,66894676
66894662,Sunwashed Tee- Washed Black,Sunwashed Tee- Washed Black,in stock,new,0.00 USD,sunwashed-tee-washed-black,https://cdn.shoplightspeed.com/shops/651012/files/70056493/screen-shot-2024-08-18-at-83805-pm.png,,66894662
66894658,Atlas Hoodie- Black,Atlas Hoodie- Black,in stock,new,0.00 USD,atlas-hoodie-black,https://cdn.shoplightspeed.com/shops/651012/files/70056488/screen-shot-2024-08-28-at-90929-am.png,,66894658
66894654,REC FLC Tapered Sweatpant- Mineral Moonlit Ocean,REC FLC Tapered Sweatpant- Mineral Moonlit Ocean,in stock,new,0.00 USD,rec-flc-tapered-sweatpant-mineral-moonlit-ocean,https://cdn.shoplightspeed.com/shops/651012/files/70056480/screen-shot-2024-09-15-at-22835-pm.png,,66894654
66894649,Corbet Reversible Pullover- Charcoal/Mid Heather Grey,Corbet Reversible Pullover- Charcoal/Mid Heather Grey,in stock,new,0.00 USD,corbet-reversible-pullover-charcoal-mid-heather-gr,https://cdn.shoplightspeed.com/shops/651012/files/70056471/screen-shot-2024-09-18-at-103516-am.png,,66894649
66894636,Stretch Terry 5-Pocket Pant- Onyx Black,Stretch Terry 5-Pocket Pant- Onyx Black,in stock,new,0.00 USD,stretch-terry-5-pocket-pant-onyx-black,https://cdn.shoplightspeed.com/shops/651012/files/70056454/fah1193-sp24-faherty-mbc0020-oyx-stretch-terry-32i.webp,,66894636
66894633,Corbet Quilted Crewneck- Dark Oat Heather,Corbet Quilted Crewneck- Dark Oat Heather,in stock,new,0.00 USD,corbet-quilted-crewneck-dark-oat-heather,https://cdn.shoplightspeed.com/shops/651012/files/70056441/corbetquilted-2000x.webp,,66894633
66894627,Clayton Textured Pullover- Grey,Clayton Textured Pullover- Grey,in stock,new,0.00 USD,clayton-textured-pullover-grey,https://cdn.shoplightspeed.com/shops/651012/files/70056431/screenshot-2024-10-24-at-120911pm.png,,66894627
66894625,Workday Bomber- Dark Navy,Workday Bomber- Dark Navy,in stock,new,0.00 USD,workday-bomber-dark-navy,https://cdn.shoplightspeed.com/shops/651012/files/70056429/screen-shot-2024-10-26-at-120934-pm.png,,66894625
66894624,Weekender Pullover- Ocean Blue Heather,Weekender Pullover- Ocean Blue Heather,in stock,new,0.00 USD,weekender-pullover-ocean-blue-heather,https://cdn.shoplightspeed.com/shops/651012/files/70056425/20240605-rhone-boston-weekender-3575-1500x.webp,,66894624
66894618,Atmosphere Midweight Jogger- Navy,Atmosphere Midweight Jogger- Navy,out of stock,new,0.00 USD,atmosphere-midweight-jogger-navy,https://cdn.shoplightspeed.com/shops/651012/files/70056417/screen-shot-2024-11-01-at-110930-am.png,,66894618
66894616,Clubhouse Golf 1/4 Zip Hoodie- Sleet Gray,Clubhouse Golf 1/4 Zip Hoodie- Sleet Gray,in stock,new,0.00 USD,clubhouse-golf-1-4-zip-hoodie-sleet-gray,https://cdn.shoplightspeed.com/shops/651012/files/70056414/screen-shot-2024-11-01-at-111625-am.png,,66894616
66894614,Atmosphere Midweight Hoodie- True Black,Atmosphere Midweight Hoodie- True Black,in stock,new,0.00 USD,atmosphere-midweight-hoodie-true-black,https://cdn.shoplightspeed.com/shops/651012/files/70056405/atmospheremidweighthoodie-trueblack-102151-959-024.webp,,66894614
66894609,Stretch Terry 5-Pocket Pant- Navy,Stretch Terry 5-Pocket Pant- Navy,in stock,new,0.00 USD,stretch-terry-5-pocket-pant-navy,https://cdn.shoplightspeed.com/shops/651012/files/70056395/fa24-faherty-mbf2437-nvy-stretch-terry-5pocket-nav.webp,,66894609
66894601,Moments- Blue & Natural,Moments- Blue & Natural,out of stock,new,0.00 USD,moments-blue-natural,https://cdn.shoplightspeed.com/shops/651012/files/70056382/db772585eb5e83ad2a405334bf3b67a8cb5f40211e77db62c9.webp,,66894601
66894596,Moments- Pine Green,Moments- Pine Green,out of stock,new,0.00 USD,moments-pine-green,https://cdn.shoplightspeed.com/shops/651012/files/70056378/ac9a0dc99bb909fc369ab2446efa34ea3a427d148a557318ce.webp,,66894596
66894594,WFH Shirt- Navy,WFH Shirt- Navy,out of stock,new,0.00 USD,wfh-shirt-navy,https://cdn.shoplightspeed.com/shops/651012/files/70056371/wfhshirt-navyheather-101622-410-0091-1500x.webp,,66894594
66894590,Commuter Pant Slim- Smoked Pearl,Commuter Pant Slim- Smoked Pearl,in stock,new,0.00 USD,commuter-pant-slim-smoked-pearl,https://cdn.shoplightspeed.com/shops/651012/files/70056363/commuterpant-slim-smokedpearl-100036-050-0136-1500.webp,,66894590
66894582,Commuter Five Pocket- Navy,Commuter Five Pocket- Navy,in stock,new,0.00 USD,commuter-five-pocket-navy,https://cdn.shoplightspeed.com/shops/651012/files/70056354/commuterfivepocket-navy-100554-410-0104-1500x.webp,,66894582
66894580,Commuter Midweight Pro Shirt Slim Fit- White,Commuter Midweight Pro Shirt Slim Fit- White,out of stock,new,0.00 USD,commuter-midweight-pro-shirt-slim-fit-white,https://cdn.shoplightspeed.com/shops/651012/files/70056351/commutermidweightpro-slim-white-001-1500x.webp,,66894580
66894573,Tahoe Flannel Shirt- Green Gingham,Tahoe Flannel Shirt- Green Gingham,in stock,new,0.00 USD,tahoe-flannel-shirt-green-gingham,https://cdn.shoplightspeed.com/shops/651012/files/70056340/h1-m-18295-ls-tahoe-flannel-shirt-gingham-green-gi.webp,,66894573
66894570,High Standard Fleece Sweatpant- Mountain Black,High Standard Fleece Sweatpant- Mountain Black,in stock,new,0.00 USD,high-standard-fleece-sweatpant-mountain-black,https://cdn.shoplightspeed.com/shops/651012/files/70056337/screen-shot-2024-11-24-at-62322-pm.png,,66894570
66894567,High Standard Fleece Hoodie- Spruce,High Standard Fleece Hoodie- Spruce,in stock,new,0.00 USD,high-standard-fleece-hoodie-spruce,https://cdn.shoplightspeed.com/shops/651012/files/70056330/fa24-faherty-mqf2413-spu-highstandardfleecehoodie.webp,,66894567
66894562,High Standard Fleece Hoodie- Antique Ivory Heather,High Standard Fleece Hoodie- Antique Ivory Heather,in stock,new,0.00 USD,high-standard-fleece-hoodie-antique-ivory-heather,https://cdn.shoplightspeed.com/shops/651012/files/70056324/screenshot-2024-12-03-at-11433pm.png,,66894562
66894559,Elevate Long Sleeve Polo- Black,Elevate Long Sleeve Polo- Black,out of stock,new,0.00 USD,elevate-long-sleeve-polo-black,https://cdn.shoplightspeed.com/shops/651012/files/70056316/screen-shot-2024-11-27-at-21201-pm.png,,66894559
66894556,Dealmaker Pants- Jean Blue,Dealmaker Pants- Jean Blue,in stock,new,0.00 USD,dealmaker-pants-jean-blue,https://cdn.shoplightspeed.com/shops/651012/files/70056307/screenshot-2024-12-01-at-90135pm.png,,66894556
66894554,Always Beyond Pullover Crew- Nocturnal Navy,Always Beyond Pullover Crew- Nocturnal Navy,in stock,new,0.00 USD,always-beyond-pullover-crew-nocturnal-navy,https://cdn.shoplightspeed.com/shops/651012/files/70056302/screen-shot-2024-12-02-at-81508-pm.png,,66894554
66894548,High Standard Fleece Quarter Zip- Antique Ivory Heather,High Standard Fleece Quarter Zip- Antique Ivory Heather,in stock,new,0.00 USD,high-standard-fleece-quarter-zip-antique-ivory-hea,https://cdn.shoplightspeed.com/shops/651012/files/70056289/screenshot-2025-04-03-at-92058am.png,,66894548
66894543,Legend Sweater Shirt- West Palm Plaid,Legend Sweater Shirt- West Palm Plaid,in stock,new,0.00 USD,legend-sweater-shirt-west-palm-plaid,https://cdn.shoplightspeed.com/shops/651012/files/70056280/screenshot-2025-04-03-at-91913am.png,,66894543
66894540,Elevate Long Sleeve- Heather Black,Elevate Long Sleeve- Heather Black,in stock,new,0.00 USD,elevate-long-sleeve-heather-black,https://cdn.shoplightspeed.com/shops/651012/files/70056276/screenshot-2024-12-04-at-120143pm.png,,66894540
66894538,MGRS hat,MGRS hat,in stock,new,0.00 USD,mgrs-hat,,,66894538
66894536,Archive Palisades Anorak- Green/Natural Colorblock,Archive Palisades Anorak- Green/Natural Colorblock,out of stock,new,0.00 USD,archive-palisades-anorak-green-natural-colorblock,https://cdn.shoplightspeed.com/shops/651012/files/70056270/h1-m-18266-archive-mixed-media-sherpa-hz-green-nat.webp,,66894536
66894533,Cuffed Beanie- Camel,Cuffed Beanie- Camel,in stock,new,0.00 USD,cuffed-beanie-camel,https://cdn.shoplightspeed.com/shops/651012/files/70056264/screen-shot-2025-01-02-at-101328-am.png,,66894533
66894528,Essential Crewneck- Bone,Essential Crewneck- Bone,in stock,new,0.00 USD,essential-crewneck-bone,https://cdn.shoplightspeed.com/shops/651012/files/70056256/screen-shot-2025-01-02-at-102259-am.png,,66894528
66894525,Essential Crewneck-Heather Grey,Essential Crewneck-Heather Grey,in stock,new,0.00 USD,essential-crewneck-heather-grey,https://cdn.shoplightspeed.com/shops/651012/files/70056248/screen-shot-2025-01-02-at-11039-pm.png,,66894525
66894522,Long Sleeve Premium Tee- Green,Long Sleeve Premium Tee- Green,in stock,new,0.00 USD,long-sleeve-premium-tee-green,https://cdn.shoplightspeed.com/shops/651012/files/70056242/screen-shot-2025-01-02-at-11217-pm.png,,66894522
66894513,Signature Jacquard Crew Tee- Mood Indigo,Signature Jacquard Crew Tee- Mood Indigo,in stock,new,0.00 USD,signature-jacquard-crew-tee-mood-indigo,https://cdn.shoplightspeed.com/shops/651012/files/70056229/screenshot-2025-04-03-at-91206am.png,,66894513
66894512,Vintage Heavy Slub Hoodie- Light Grey,Vintage Heavy Slub Hoodie- Light Grey,in stock,new,0.00 USD,vintage-heavy-slub-hoodie-light-grey,https://cdn.shoplightspeed.com/shops/651012/files/70056224/screenshot-2025-01-17-at-113735am.png,,66894512
66894510,Sunwashed Slub Hoodie- Sage Creek,Sunwashed Slub Hoodie- Sage Creek,in stock,new,0.00 USD,sunwashed-slub-hoodie-sage-creek,https://cdn.shoplightspeed.com/shops/651012/files/70056218/screenshot-2025-04-03-at-92754am.png,,66894510
66894503,LS Sunwashed Tee- Dune Navy,LS Sunwashed Tee- Dune Navy,in stock,new,0.00 USD,ls-sunwashed-tee-dune-navy,https://cdn.shoplightspeed.com/shops/651012/files/70056208/sp25-faherty-mens-mks2513-duy-lssunwashedtee-dunen.webp,,66894503
66894498,LS Sunwashed Tee- White,LS Sunwashed Tee- White,in stock,new,0.00 USD,ls-sunwashed-tee-white,https://cdn.shoplightspeed.com/shops/651012/files/70056203/sp25-faherty-mens-mks2513-wht-lssunwashedtee-white.webp,,66894498
66894494,Sunwashed Pocket Tee- White,Sunwashed Pocket Tee- White,in stock,new,0.00 USD,sunwashed-pocket-tee-white,https://cdn.shoplightspeed.com/shops/651012/files/70056202/screen-shot-2025-01-06-at-20303-pm.png,,66894494
66894491,Sunwashed Pocket Tee- Dune Navy,Sunwashed Pocket Tee- Dune Navy,in stock,new,0.00 USD,sunwashed-pocket-tee-dune-navy,https://cdn.shoplightspeed.com/shops/651012/files/70056201/screen-shot-2025-01-06-at-20522-pm.png,,66894491
66894490,Sunwashed Pocket Tee- Island Dune Heather,Sunwashed Pocket Tee- Island Dune Heather,in stock,new,0.00 USD,sunwashed-pocket-tee-island-dune-heather,https://cdn.shoplightspeed.com/shops/651012/files/70056199/screen-shot-2025-01-06-at-20713-pm.png,,66894490
66894482,Sunwashed Pocket Tee- Sage Creek,Sunwashed Pocket Tee- Sage Creek,in stock,new,0.00 USD,sunwashed-pocket-tee-sage-creek,https://cdn.shoplightspeed.com/shops/651012/files/70056180/screenshot-2025-04-03-at-92636am.png,,66894482
66894478,Sunwashed Pocket Tee- Sky,Sunwashed Pocket Tee- Sky,in stock,new,0.00 USD,sunwashed-pocket-tee-sky,https://cdn.shoplightspeed.com/shops/651012/files/70056175/screenshot-2025-04-03-at-91549am.png,,66894478
66894476,Sunwashed Pocket Tee- Vista Plum,Sunwashed Pocket Tee- Vista Plum,out of stock,new,0.00 USD,sunwashed-pocket-tee-vista-plum,https://cdn.shoplightspeed.com/shops/651012/files/70056170/808df3bf51d5bb467a1433c69a75660665ac2f54.jpg,,66894476
66894468,Heritage Midweight Hoodie- Navy Heather,Heritage Midweight Hoodie- Navy Heather,in stock,new,0.00 USD,heritage-midweight-hoodie-navy-heather,https://cdn.shoplightspeed.com/shops/651012/files/70056158/screen-shot-2025-01-06-at-30217-pm.png,,66894468
66894465,WFH Polo- Navy Heather,WFH Polo- Navy Heather,in stock,new,0.00 USD,wfh-polo-navy-heather,https://cdn.shoplightspeed.com/shops/651012/files/70056152/wfhpolo-navyheather-050-1500x.webp,,66894465
66894458,Atmosphere Midweight Jogger- True Black,Atmosphere Midweight Jogger- True Black,in stock,new,0.00 USD,atmosphere-midweight-jogger-true-black,https://cdn.shoplightspeed.com/shops/651012/files/70056147/atmospheremidweightjogger-trueblack-101754-959-150.webp,,66894458
66894456,Origin Tee- White,Origin Tee- White,in stock,new,0.00 USD,origin-tee-white,https://cdn.shoplightspeed.com/shops/651012/files/70056137/screen-shot-2025-01-06-at-32255-pm.png,,66894456
66894454,Origin Tee- True Navy,Origin Tee- True Navy,in stock,new,0.00 USD,origin-tee-true-navy,https://cdn.shoplightspeed.com/shops/651012/files/70056130/screen-shot-2025-01-06-at-32526-pm.png,,66894454
66894449,Pursuit Pant- True Navy,Pursuit Pant- True Navy,in stock,new,0.00 USD,pursuit-pant-true-navy,https://cdn.shoplightspeed.com/shops/651012/files/70056116/pursuitpant-truenavy-102152-404-c1-1500x.webp,,66894449
66894445,Range Hoodie- Black,Range Hoodie- Black,in stock,new,0.00 USD,range-hoodie-black,https://cdn.shoplightspeed.com/shops/651012/files/70056112/screen-shot-2025-01-06-at-33151-pm.png,,66894445
66894437,Range Hoodie- Gravel,Range Hoodie- Gravel,in stock,new,0.00 USD,range-hoodie-gravel,https://cdn.shoplightspeed.com/shops/651012/files/70056096/screen-shot-2025-01-06-at-33342-pm.png,,66894437
66894433,Liam Sweater Polo- Vetiver/Ivory,Liam Sweater Polo- Vetiver/Ivory,in stock,new,0.00 USD,liam-sweater-polo-vetiver-ivory,https://cdn.shoplightspeed.com/shops/651012/files/70056090/screen-shot-2025-01-09-at-122238-pm.png,,66894433
66894430,Courtside Crewneck Sweater- Heather Grey,Courtside Crewneck Sweater- Heather Grey,in stock,new,0.00 USD,courtside-crewneck-sweater-heather-grey,https://cdn.shoplightspeed.com/shops/651012/files/70056082/screenshot-2025-01-23-at-13136pm.png,,66894430
66894414,Signature Hoodie- Black,Signature Hoodie- Black,in stock,new,0.00 USD,signature-hoodie-black,https://cdn.shoplightspeed.com/shops/651012/files/70056059/screen-shot-2025-01-29-at-41751-pm.png,,66894414
66894409,Signature Hoodie- Bone,Signature Hoodie- Bone,out of stock,new,0.00 USD,signature-hoodie-bone,https://cdn.shoplightspeed.com/shops/651012/files/70056056/screen-shot-2025-01-29-at-42706-pm.png,,66894409
66894400,Signature Hoodie- Heather Grey,Signature Hoodie- Heather Grey,in stock,new,0.00 USD,signature-hoodie-heather-grey,https://cdn.shoplightspeed.com/shops/651012/files/70056048/screen-shot-2025-01-29-at-42930-pm.png,,66894400
66894385,Every Body Hoodie- Black,Every Body Hoodie- Black,in stock,new,0.00 USD,every-body-hoodie-black,https://cdn.shoplightspeed.com/shops/651012/files/70056032/screenshot-2025-02-19-at-45547pm.png,,66894385
66894378,Every Body Hoodie- Fresh Snow,Every Body Hoodie- Fresh Snow,in stock,new,0.00 USD,every-body-hoodie-fresh-snow,https://cdn.shoplightspeed.com/shops/651012/files/70056024/nf7876d-fresh-snow-1047.webp,,66894378
66894367,Commuter Polo Slim Fit- White/Green Double Stripe,Commuter Polo Slim Fit- White/Green Double Stripe,in stock,new,0.00 USD,commuter-polo-slim-fit-white-green-double-stripe,https://cdn.shoplightspeed.com/shops/651012/files/70056013/commuterpolo-slim-white-greendoublestripe-101248-3.webp,,66894367
66894364,Top Flight Vest- Tidal Green,Top Flight Vest- Tidal Green,in stock,new,0.00 USD,top-flight-vest-tidal-green,https://cdn.shoplightspeed.com/shops/651012/files/70056006/topflightvest-tidalgreen-101686-355-c1-1500x.webp,,66894364
66894357,Golf Sport Polo- Washed Clay/Tidal Green/Bright White,Golf Sport Polo- Washed Clay/Tidal Green/Bright White,in stock,new,0.00 USD,golf-sport-polo-washed-clay-tidal-green-bright-whi,https://cdn.shoplightspeed.com/shops/651012/files/70056000/golfsportpolo-washedclay-tidalgreen-brightwhite-10.webp,,66894357
66894348,Golf Sport Polo Spread Collar- Tidal Green Wavy Stripe,Golf Sport Polo Spread Collar- Tidal Green Wavy Stripe,in stock,new,0.00 USD,golf-sport-polo-spread-collar-tidal-green-wavy-str,https://cdn.shoplightspeed.com/shops/651012/files/70055996/golfsportpolospreadcollar-tidalgreen-wavystripe-10.webp,,66894348
66894343,Rise 1/4 Zip- Dark Teal,Rise 1/4 Zip- Dark Teal,in stock,new,0.00 USD,rise-1-4-zip-dark-teal,https://cdn.shoplightspeed.com/shops/651012/files/70055988/riseqtrzip-darkteal-102247-964-c1-1500x.webp,,66894343
66894332,Reign Short Sleeve- Deep Sea Blue/Dark Teal Heather,Reign Short Sleeve- Deep Sea Blue/Dark Teal Heather,in stock,new,0.00 USD,reign-short-sleeve-deep-sea-blue-dark-teal-heather,https://cdn.shoplightspeed.com/shops/651012/files/70055979/reignshortsleeve-deepseablue-darktealheather-10030.webp,,66894332
66894329,"7"" Pursuit Short- Unlined- Tidal Green","7"" Pursuit Short- Unlined- Tidal Green",in stock,new,0.00 USD,7-pursuit-short-unlined-tidal-green,https://cdn.shoplightspeed.com/shops/651012/files/70055973/7inpursuitshort-unlined-tidalgreen-101722-355-c1-1.webp,,66894329
66894322,"7"" Pursuit Short- Unlined- Dark Teal","7"" Pursuit Short- Unlined- Dark Teal",in stock,new,0.00 USD,7-pursuit-short-unlined-dark-teal,https://cdn.shoplightspeed.com/shops/651012/files/70055969/7inpursuitshort-unlined-darkteal-101722-964-c1-150.webp,,66894322
66894316,Links Golf Polo- Tidal Green,Links Golf Polo- Tidal Green,in stock,new,0.00 USD,links-golf-polo-tidal-green,https://cdn.shoplightspeed.com/shops/651012/files/70055967/linksgolfpolo-tidalgreen-102186-355-c1-1500x.webp,,66894316
66894310,Portola Beach Hoodie- White/Navy,Portola Beach Hoodie- White/Navy,in stock,new,0.00 USD,portola-beach-hoodie-white-navy,https://cdn.shoplightspeed.com/shops/651012/files/70055959/screenshot-2025-04-03-at-91010am.png,,66894310
