id,title,description,availability,condition,price,link,image_link,brand,item_group_id
66894649,Corbet Reversible Pullover- Charcoal/Mid Heather Grey,Corbet Reversible Pullover- Charcoal/Mid Heather Grey,in stock,new,148.00 USD,corbet-reversible-pullover-charcoal-mid-heather-gr,https://cdn.shoplightspeed.com/shops/651012/files/70056471/screen-shot-2024-09-18-at-103516-am.png,,66894649
66894636,Stretch Terry 5-Pocket Pant- Onyx Black,Stretch Terry 5-Pocket Pant- Onyx Black,in stock,new,178.00 USD,stretch-terry-5-pocket-pant-onyx-black,https://cdn.shoplightspeed.com/shops/651012/files/70056454/fah1193-sp24-faherty-mbc0020-oyx-stretch-terry-32i.webp,,66894636
66894633,Corbet Quilted Crewneck- Dark Oat Heather,Corbet Quilted Crewneck- Dark Oat Heather,in stock,new,98.00 USD,corbet-quilted-crewneck-dark-oat-heather,https://cdn.shoplightspeed.com/shops/651012/files/70056441/corbetquilted-2000x.webp,,66894633
66894627,Clayton Textured Pullover- Grey,Clayton Textured Pullover- Grey,in stock,new,98.00 USD,clayton-textured-pullover-grey,https://cdn.shoplightspeed.com/shops/651012/files/70056431/screenshot-2024-10-24-at-120911pm.png,,66894627
66894625,Workday Bomber- Dark Navy,Workday Bomber- Dark Navy,in stock,new,148.00 USD,workday-bomber-dark-navy,https://cdn.shoplightspeed.com/shops/651012/files/70056429/screen-shot-2024-10-26-at-120934-pm.png,,66894625
66894624,Weekender Pullover- Ocean Blue Heather,Weekender Pullover- Ocean Blue Heather,in stock,new,138.00 USD,weekender-pullover-ocean-blue-heather,https://cdn.shoplightspeed.com/shops/651012/files/70056425/20240605-rhone-boston-weekender-3575-1500x.webp,,66894624
66894618,Atmosphere Midweight Jogger- Navy,Atmosphere Midweight Jogger- Navy,out of stock,new,58.80 USD,atmosphere-midweight-jogger-navy,https://cdn.shoplightspeed.com/shops/651012/files/70056417/screen-shot-2024-11-01-at-110930-am.png,,66894618
66894616,Clubhouse Golf 1/4 Zip Hoodie- Sleet Gray,Clubhouse Golf 1/4 Zip Hoodie- Sleet Gray,in stock,new,128.00 USD,clubhouse-golf-1-4-zip-hoodie-sleet-gray,https://cdn.shoplightspeed.com/shops/651012/files/70056414/screen-shot-2024-11-01-at-111625-am.png,,66894616
66894614,Atmosphere Midweight Hoodie- True Black,Atmosphere Midweight Hoodie- True Black,in stock,new,108.00 USD,atmosphere-midweight-hoodie-true-black,https://cdn.shoplightspeed.com/shops/651012/files/70056405/atmospheremidweighthoodie-trueblack-102151-959-024.webp,,66894614
66894609,Stretch Terry 5-Pocket Pant- Navy,Stretch Terry 5-Pocket Pant- Navy,in stock,new,178.00 USD,stretch-terry-5-pocket-pant-navy,https://cdn.shoplightspeed.com/shops/651012/files/70056395/fa24-faherty-mbf2437-nvy-stretch-terry-5pocket-nav.webp,,66894609
66894601,Moments- Blue & Natural,Moments- Blue & Natural,out of stock,new,42.00 USD,moments-blue-natural,https://cdn.shoplightspeed.com/shops/651012/files/70056382/db772585eb5e83ad2a405334bf3b67a8cb5f40211e77db62c9.webp,,66894601
66894596,Moments- Pine Green,Moments- Pine Green,out of stock,new,42.00 USD,moments-pine-green,https://cdn.shoplightspeed.com/shops/651012/files/70056378/ac9a0dc99bb909fc369ab2446efa34ea3a427d148a557318ce.webp,,66894596
66894594,WFH Shirt- Navy,WFH Shirt- Navy,out of stock,new,128.00 USD,wfh-shirt-navy,https://cdn.shoplightspeed.com/shops/651012/files/70056371/wfhshirt-navyheather-101622-410-0091-1500x.webp,,66894594
66894590,Commuter Pant Slim- Smoked Pearl,Commuter Pant Slim- Smoked Pearl,in stock,new,138.00 USD,commuter-pant-slim-smoked-pearl,https://cdn.shoplightspeed.com/shops/651012/files/70056363/commuterpant-slim-smokedpearl-100036-050-0136-1500.webp,,66894590
66894582,Commuter Five Pocket- Navy,Commuter Five Pocket- Navy,in stock,new,138.00 USD,commuter-five-pocket-navy,https://cdn.shoplightspeed.com/shops/651012/files/70056354/commuterfivepocket-navy-100554-410-0104-1500x.webp,,66894582
66894580,Commuter Midweight Pro Shirt Slim Fit- White,Commuter Midweight Pro Shirt Slim Fit- White,out of stock,new,148.00 USD,commuter-midweight-pro-shirt-slim-fit-white,https://cdn.shoplightspeed.com/shops/651012/files/70056351/commutermidweightpro-slim-white-001-1500x.webp,,66894580
66894573,Tahoe Flannel Shirt- Green Gingham,Tahoe Flannel Shirt- Green Gingham,in stock,new,76.80 USD,tahoe-flannel-shirt-green-gingham,https://cdn.shoplightspeed.com/shops/651012/files/70056340/h1-m-18295-ls-tahoe-flannel-shirt-gingham-green-gi.webp,,66894573
66894570,High Standard Fleece Sweatpant- Mountain Black,High Standard Fleece Sweatpant- Mountain Black,in stock,new,128.00 USD,high-standard-fleece-sweatpant-mountain-black,https://cdn.shoplightspeed.com/shops/651012/files/70056337/screen-shot-2024-11-24-at-62322-pm.png,,66894570
66894567,High Standard Fleece Hoodie- Spruce,High Standard Fleece Hoodie- Spruce,in stock,new,148.00 USD,high-standard-fleece-hoodie-spruce,https://cdn.shoplightspeed.com/shops/651012/files/70056330/fa24-faherty-mqf2413-spu-highstandardfleecehoodie.webp,,66894567
66894562,High Standard Fleece Hoodie- Antique Ivory Heather,High Standard Fleece Hoodie- Antique Ivory Heather,in stock,new,148.00 USD,high-standard-fleece-hoodie-antique-ivory-heather,https://cdn.shoplightspeed.com/shops/651012/files/70056324/screenshot-2024-12-03-at-11433pm.png,,66894562
66894559,Elevate Long Sleeve Polo- Black,Elevate Long Sleeve Polo- Black,out of stock,new,52.80 USD,elevate-long-sleeve-polo-black,https://cdn.shoplightspeed.com/shops/651012/files/70056316/screen-shot-2024-11-27-at-21201-pm.png,,66894559
66894556,Dealmaker Pants- Jean Blue,Dealmaker Pants- Jean Blue,in stock,new,128.00 USD,dealmaker-pants-jean-blue,https://cdn.shoplightspeed.com/shops/651012/files/70056307/screenshot-2024-12-01-at-90135pm.png,,66894556
66894554,Always Beyond Pullover Crew- Nocturnal Navy,Always Beyond Pullover Crew- Nocturnal Navy,in stock,new,99.00 USD,always-beyond-pullover-crew-nocturnal-navy,https://cdn.shoplightspeed.com/shops/651012/files/70056302/screen-shot-2024-12-02-at-81508-pm.png,,66894554
66894548,High Standard Fleece Quarter Zip- Antique Ivory Heather,High Standard Fleece Quarter Zip- Antique Ivory Heather,in stock,new,178.00 USD,high-standard-fleece-quarter-zip-antique-ivory-hea,https://cdn.shoplightspeed.com/shops/651012/files/70056289/screenshot-2025-04-03-at-92058am.png,,66894548
66894543,Legend Sweater Shirt- West Palm Plaid,Legend Sweater Shirt- West Palm Plaid,in stock,new,178.00 USD,legend-sweater-shirt-west-palm-plaid,https://cdn.shoplightspeed.com/shops/651012/files/70056280/screenshot-2025-04-03-at-91913am.png,,66894543
66894540,Elevate Long Sleeve- Heather Black,Elevate Long Sleeve- Heather Black,in stock,new,68.00 USD,elevate-long-sleeve-heather-black,https://cdn.shoplightspeed.com/shops/651012/files/70056276/screenshot-2024-12-04-at-120143pm.png,,66894540
66894538,MGRS hat,MGRS hat,in stock,new,32.00 USD,mgrs-hat,,,66894538
66894536,Archive Palisades Anorak- Green/Natural Colorblock,Archive Palisades Anorak- Green/Natural Colorblock,out of stock,new,178.00 USD,archive-palisades-anorak-green-natural-colorblock,https://cdn.shoplightspeed.com/shops/651012/files/70056270/h1-m-18266-archive-mixed-media-sherpa-hz-green-nat.webp,,66894536
66894533,Cuffed Beanie- Camel,Cuffed Beanie- Camel,in stock,new,35.00 USD,cuffed-beanie-camel,https://cdn.shoplightspeed.com/shops/651012/files/70056264/screen-shot-2025-01-02-at-101328-am.png,,66894533
66894528,Essential Crewneck- Bone,Essential Crewneck- Bone,in stock,new,78.00 USD,essential-crewneck-bone,https://cdn.shoplightspeed.com/shops/651012/files/70056256/screen-shot-2025-01-02-at-102259-am.png,,66894528
66894525,Essential Crewneck-Heather Grey,Essential Crewneck-Heather Grey,in stock,new,78.00 USD,essential-crewneck-heather-grey,https://cdn.shoplightspeed.com/shops/651012/files/70056248/screen-shot-2025-01-02-at-11039-pm.png,,66894525
66894522,Long Sleeve Premium Tee- Green,Long Sleeve Premium Tee- Green,in stock,new,58.00 USD,long-sleeve-premium-tee-green,https://cdn.shoplightspeed.com/shops/651012/files/70056242/screen-shot-2025-01-02-at-11217-pm.png,,66894522
66894513,Signature Jacquard Crew Tee- Mood Indigo,Signature Jacquard Crew Tee- Mood Indigo,in stock,new,54.00 USD,signature-jacquard-crew-tee-mood-indigo,https://cdn.shoplightspeed.com/shops/651012/files/70056229/screenshot-2025-04-03-at-91206am.png,,66894513
66894512,Vintage Heavy Slub Hoodie- Light Grey,Vintage Heavy Slub Hoodie- Light Grey,in stock,new,98.00 USD,vintage-heavy-slub-hoodie-light-grey,https://cdn.shoplightspeed.com/shops/651012/files/70056224/screenshot-2025-01-17-at-113735am.png,,66894512
66894510,Sunwashed Slub Hoodie- Sage Creek,Sunwashed Slub Hoodie- Sage Creek,in stock,new,98.00 USD,sunwashed-slub-hoodie-sage-creek,https://cdn.shoplightspeed.com/shops/651012/files/70056218/screenshot-2025-04-03-at-92754am.png,,66894510
66894503,LS Sunwashed Tee- Dune Navy,LS Sunwashed Tee- Dune Navy,in stock,new,88.00 USD,ls-sunwashed-tee-dune-navy,https://cdn.shoplightspeed.com/shops/651012/files/70056208/sp25-faherty-mens-mks2513-duy-lssunwashedtee-dunen.webp,,66894503
66894498,LS Sunwashed Tee- White,LS Sunwashed Tee- White,in stock,new,88.00 USD,ls-sunwashed-tee-white,https://cdn.shoplightspeed.com/shops/651012/files/70056203/sp25-faherty-mens-mks2513-wht-lssunwashedtee-white.webp,,66894498
66894494,Sunwashed Pocket Tee- White,Sunwashed Pocket Tee- White,in stock,new,68.00 USD,sunwashed-pocket-tee-white,https://cdn.shoplightspeed.com/shops/651012/files/70056202/screen-shot-2025-01-06-at-20303-pm.png,,66894494
66894491,Sunwashed Pocket Tee- Dune Navy,Sunwashed Pocket Tee- Dune Navy,in stock,new,68.00 USD,sunwashed-pocket-tee-dune-navy,https://cdn.shoplightspeed.com/shops/651012/files/70056201/screen-shot-2025-01-06-at-20522-pm.png,,66894491
66894490,Sunwashed Pocket Tee- Island Dune Heather,Sunwashed Pocket Tee- Island Dune Heather,in stock,new,68.00 USD,sunwashed-pocket-tee-island-dune-heather,https://cdn.shoplightspeed.com/shops/651012/files/70056199/screen-shot-2025-01-06-at-20713-pm.png,,66894490
66894482,Sunwashed Pocket Tee- Sage Creek,Sunwashed Pocket Tee- Sage Creek,in stock,new,68.00 USD,sunwashed-pocket-tee-sage-creek,https://cdn.shoplightspeed.com/shops/651012/files/70056180/screenshot-2025-04-03-at-92636am.png,,66894482
66894478,Sunwashed Pocket Tee- Sky,Sunwashed Pocket Tee- Sky,in stock,new,68.00 USD,sunwashed-pocket-tee-sky,https://cdn.shoplightspeed.com/shops/651012/files/70056175/screenshot-2025-04-03-at-91549am.png,,66894478
66894476,Sunwashed Pocket Tee- Vista Plum,Sunwashed Pocket Tee- Vista Plum,out of stock,new,68.00 USD,sunwashed-pocket-tee-vista-plum,https://cdn.shoplightspeed.com/shops/651012/files/70056170/808df3bf51d5bb467a1433c69a75660665ac2f54.jpg,,66894476
66894468,Heritage Midweight Hoodie- Navy Heather,Heritage Midweight Hoodie- Navy Heather,in stock,new,118.00 USD,heritage-midweight-hoodie-navy-heather,https://cdn.shoplightspeed.com/shops/651012/files/70056158/screen-shot-2025-01-06-at-30217-pm.png,,66894468
66894465,WFH Polo- Navy Heather,WFH Polo- Navy Heather,in stock,new,78.00 USD,wfh-polo-navy-heather,https://cdn.shoplightspeed.com/shops/651012/files/70056152/wfhpolo-navyheather-050-1500x.webp,,66894465
66894458,Atmosphere Midweight Jogger- True Black,Atmosphere Midweight Jogger- True Black,in stock,new,98.00 USD,atmosphere-midweight-jogger-true-black,https://cdn.shoplightspeed.com/shops/651012/files/70056147/atmospheremidweightjogger-trueblack-101754-959-150.webp,,66894458
66894456,Origin Tee- White,Origin Tee- White,in stock,new,48.00 USD,origin-tee-white,https://cdn.shoplightspeed.com/shops/651012/files/70056137/screen-shot-2025-01-06-at-32255-pm.png,,66894456
66894454,Origin Tee- True Navy,Origin Tee- True Navy,in stock,new,48.00 USD,origin-tee-true-navy,https://cdn.shoplightspeed.com/shops/651012/files/70056130/screen-shot-2025-01-06-at-32526-pm.png,,66894454
66894449,Pursuit Pant- True Navy,Pursuit Pant- True Navy,in stock,new,118.00 USD,pursuit-pant-true-navy,https://cdn.shoplightspeed.com/shops/651012/files/70056116/pursuitpant-truenavy-102152-404-c1-1500x.webp,,66894449
66894445,Range Hoodie- Black,Range Hoodie- Black,in stock,new,138.00 USD,range-hoodie-black,https://cdn.shoplightspeed.com/shops/651012/files/70056112/screen-shot-2025-01-06-at-33151-pm.png,,66894445
66894437,Range Hoodie- Gravel,Range Hoodie- Gravel,in stock,new,138.00 USD,range-hoodie-gravel,https://cdn.shoplightspeed.com/shops/651012/files/70056096/screen-shot-2025-01-06-at-33342-pm.png,,66894437
66894433,Liam Sweater Polo- Vetiver/Ivory,Liam Sweater Polo- Vetiver/Ivory,in stock,new,128.00 USD,liam-sweater-polo-vetiver-ivory,https://cdn.shoplightspeed.com/shops/651012/files/70056090/screen-shot-2025-01-09-at-122238-pm.png,,66894433
66894430,Courtside Crewneck Sweater- Heather Grey,Courtside Crewneck Sweater- Heather Grey,in stock,new,76.80 USD,courtside-crewneck-sweater-heather-grey,https://cdn.shoplightspeed.com/shops/651012/files/70056082/screenshot-2025-01-23-at-13136pm.png,,66894430
66894414,Signature Hoodie- Black,Signature Hoodie- Black,in stock,new,88.00 USD,signature-hoodie-black,https://cdn.shoplightspeed.com/shops/651012/files/70056059/screen-shot-2025-01-29-at-41751-pm.png,,66894414
66894409,Signature Hoodie- Bone,Signature Hoodie- Bone,out of stock,new,88.00 USD,signature-hoodie-bone,https://cdn.shoplightspeed.com/shops/651012/files/70056056/screen-shot-2025-01-29-at-42706-pm.png,,66894409
66894400,Signature Hoodie- Heather Grey,Signature Hoodie- Heather Grey,in stock,new,88.00 USD,signature-hoodie-heather-grey,https://cdn.shoplightspeed.com/shops/651012/files/70056048/screen-shot-2025-01-29-at-42930-pm.png,,66894400
66894385,Every Body Hoodie- Black,Every Body Hoodie- Black,in stock,new,118.00 USD,every-body-hoodie-black,https://cdn.shoplightspeed.com/shops/651012/files/70056032/screenshot-2025-02-19-at-45547pm.png,,66894385
66894378,Every Body Hoodie- Fresh Snow,Every Body Hoodie- Fresh Snow,in stock,new,118.00 USD,every-body-hoodie-fresh-snow,https://cdn.shoplightspeed.com/shops/651012/files/70056024/nf7876d-fresh-snow-1047.webp,,66894378
66894367,Commuter Polo Slim Fit- White/Green Double Stripe,Commuter Polo Slim Fit- White/Green Double Stripe,in stock,new,98.00 USD,commuter-polo-slim-fit-white-green-double-stripe,https://cdn.shoplightspeed.com/shops/651012/files/70056013/commuterpolo-slim-white-greendoublestripe-101248-3.webp,,66894367
66894364,Top Flight Vest- Tidal Green,Top Flight Vest- Tidal Green,in stock,new,128.00 USD,top-flight-vest-tidal-green,https://cdn.shoplightspeed.com/shops/651012/files/70056006/topflightvest-tidalgreen-101686-355-c1-1500x.webp,,66894364
66894357,Golf Sport Polo- Washed Clay/Tidal Green/Bright White,Golf Sport Polo- Washed Clay/Tidal Green/Bright White,in stock,new,108.00 USD,golf-sport-polo-washed-clay-tidal-green-bright-whi,https://cdn.shoplightspeed.com/shops/651012/files/70056000/golfsportpolo-washedclay-tidalgreen-brightwhite-10.webp,,66894357
66894348,Golf Sport Polo Spread Collar- Tidal Green Wavy Stripe,Golf Sport Polo Spread Collar- Tidal Green Wavy Stripe,in stock,new,108.00 USD,golf-sport-polo-spread-collar-tidal-green-wavy-str,https://cdn.shoplightspeed.com/shops/651012/files/70055996/golfsportpolospreadcollar-tidalgreen-wavystripe-10.webp,,66894348
66894343,Rise 1/4 Zip- Dark Teal,Rise 1/4 Zip- Dark Teal,in stock,new,108.00 USD,rise-1-4-zip-dark-teal,https://cdn.shoplightspeed.com/shops/651012/files/70055988/riseqtrzip-darkteal-102247-964-c1-1500x.webp,,66894343
66894332,Reign Short Sleeve- Deep Sea Blue/Dark Teal Heather,Reign Short Sleeve- Deep Sea Blue/Dark Teal Heather,in stock,new,68.00 USD,reign-short-sleeve-deep-sea-blue-dark-teal-heather,https://cdn.shoplightspeed.com/shops/651012/files/70055979/reignshortsleeve-deepseablue-darktealheather-10030.webp,,66894332
66894329,"7"" Pursuit Short- Unlined- Tidal Green","7"" Pursuit Short- Unlined- Tidal Green",in stock,new,74.00 USD,7-pursuit-short-unlined-tidal-green,https://cdn.shoplightspeed.com/shops/651012/files/70055973/7inpursuitshort-unlined-tidalgreen-101722-355-c1-1.webp,,66894329
66894322,"7"" Pursuit Short- Unlined- Dark Teal","7"" Pursuit Short- Unlined- Dark Teal",in stock,new,74.00 USD,7-pursuit-short-unlined-dark-teal,https://cdn.shoplightspeed.com/shops/651012/files/70055969/7inpursuitshort-unlined-darkteal-101722-964-c1-150.webp,,66894322
66894316,Links Golf Polo- Tidal Green,Links Golf Polo- Tidal Green,in stock,new,88.00 USD,links-golf-polo-tidal-green,https://cdn.shoplightspeed.com/shops/651012/files/70055967/linksgolfpolo-tidalgreen-102186-355-c1-1500x.webp,,66894316
66894310,Portola Beach Hoodie- White/Navy,Portola Beach Hoodie- White/Navy,in stock,new,118.00 USD,portola-beach-hoodie-white-navy,https://cdn.shoplightspeed.com/shops/651012/files/70055959/screenshot-2025-04-03-at-91010am.png,,66894310
66894297,Classic Stretch Selvage Shirt- Green Palm Print,Classic Stretch Selvage Shirt- Green Palm Print,out of stock,new,118.00 USD,classic-stretch-selvage-shirt-green-palm-print,https://cdn.shoplightspeed.com/shops/651012/files/70055952/screenshot-2025-02-26-at-43442pm.png,,66894297
66894287,"Saturday Beach Short 6""- Sand","Saturday Beach Short 6""- Sand",in stock,new,88.00 USD,saturday-beach-short-6-sand,https://cdn.shoplightspeed.com/shops/651012/files/70055946/screenshot-2025-02-26-at-45708pm.png,,66894287
66894262,Air Polo- Iceberg Green,Air Polo- Iceberg Green,in stock,new,78.00 USD,air-polo-iceberg-green,https://cdn.shoplightspeed.com/shops/651012/files/70055933/s3-m-17353-air-polo-w-button-collar-iceberg-green.webp,,66894262
66894254,Commuter Polo Slim- Lavender Dusk,Commuter Polo Slim- Lavender Dusk,in stock,new,98.00 USD,commuter-polo-slim-lavender-dusk,https://cdn.shoplightspeed.com/shops/651012/files/70055918/screenshot-2025-02-27-at-83602am.png,,66894254
66894245,5.5' R&R Trunk- Arctic Blue,5.5' R&R Trunk- Arctic Blue,in stock,new,88.00 USD,55-r-r-trunk-arctic-blue,https://cdn.shoplightspeed.com/shops/651012/files/70055904/55inrandrtrunk-arcticblue-101352-042-c1-1000x.webp,,66894245
66894234,9' Momentum Golf Short- Arctic Blue/Blue Blizzard,9' Momentum Golf Short- Arctic Blue/Blue Blizzard,in stock,new,108.00 USD,9-momentum-golf-short-arctic-blue-blue-blizzard,https://cdn.shoplightspeed.com/shops/651012/files/70055894/9inmomentumgolfshort-arcticblue-blueblizzard-10168.webp,,66894234
66894220,7' Pursuit Short- Arctic Blue,7' Pursuit Short- Arctic Blue,in stock,new,74.00 USD,7-pursuit-short-arctic-blue,https://cdn.shoplightspeed.com/shops/651012/files/70055873/screenshot-2025-02-27-at-84554am.png,,66894220
66894214,WFH Polo- Sleet Gray/White Heather,WFH Polo- Sleet Gray/White Heather,out of stock,new,78.00 USD,wfh-polo-sleet-gray-white-heather,https://cdn.shoplightspeed.com/shops/651012/files/70055866/screenshot-2025-02-27-at-84807am.png,,66894214
66894207,Momentum Golf Five Pocket- Arctic Blue/Blue Blizzard,Momentum Golf Five Pocket- Arctic Blue/Blue Blizzard,in stock,new,148.00 USD,momentum-golf-five-pocket-arctic-blue-blue-blizzar,https://cdn.shoplightspeed.com/shops/651012/files/70055858/momentumgolffivepocket-arcticblue-blueblizzard-101.jpg,,66894207
66894200,Johnny Collar Polo- Sandstone/White,Johnny Collar Polo- Sandstone/White,in stock,new,118.00 USD,johnny-collar-polo-sandstone-white,https://cdn.shoplightspeed.com/shops/651012/files/70055850/johnnycollarpolo-sandstone-white-101838-284-c1-100.webp,,66894200
66894196,Origin Tee- Arctic Blue,Origin Tee- Arctic Blue,in stock,new,48.00 USD,origin-tee-arctic-blue,https://cdn.shoplightspeed.com/shops/651012/files/70055845/origintee-arcticblue-102142-042-c1-1000x-1.webp,,66894196
66894193,Regatta Pique Polo- Sandstone,Regatta Pique Polo- Sandstone,in stock,new,88.00 USD,regatta-pique-polo-sandstone,https://cdn.shoplightspeed.com/shops/651012/files/70055843/screenshot-2025-02-27-at-90022am.png,,66894193
66894184,Commuter Shirt Semi Spread Collar- Pink Mini Windowpane,Commuter Shirt Semi Spread Collar- Pink Mini Windowpane,in stock,new,138.00 USD,commuter-shirt-semi-spread-collar-pink-mini-window,https://cdn.shoplightspeed.com/shops/651012/files/70055834/screenshot-2025-02-27-at-90818am.png,,66894184
66894175,Reign Short Sleeve- Arctic Blue/White Heather,Reign Short Sleeve- Arctic Blue/White Heather,in stock,new,68.00 USD,reign-short-sleeve-arctic-blue-white-heather,https://cdn.shoplightspeed.com/shops/651012/files/70055826/screenshot-2025-02-27-at-92323am.png,,66894175
66894172,Commuter Shirt Slim Fit- Lavender Dusk,Commuter Shirt Slim Fit- Lavender Dusk,in stock,new,138.00 USD,commuter-shirt-slim-fit-lavender-dusk,https://cdn.shoplightspeed.com/shops/651012/files/70055820/commutershirt-slimfit-lavenderduskoxford-101525-53.webp,,66894172
66894160,Golf Sport Polo- Sapphire Blue/Arctic Blue/White Geo,Golf Sport Polo- Sapphire Blue/Arctic Blue/White Geo,in stock,new,108.00 USD,golf-sport-polo-sapphire-blue-arctic-blue-white-ge,https://cdn.shoplightspeed.com/shops/651012/files/70055802/screenshot-2025-02-27-at-93048am.png,,66894160
66894155,Commuter Shirt Slim Fit- Blue Mini Windowpane,Commuter Shirt Slim Fit- Blue Mini Windowpane,in stock,new,138.00 USD,commuter-shirt-slim-fit-blue-mini-windowpane,https://cdn.shoplightspeed.com/shops/651012/files/70055782/screenshot-2025-02-27-at-93950am.png,,66894155
66894147,Compass Knit Tee- White/True Navy Stripe,Compass Knit Tee- White/True Navy Stripe,in stock,new,88.00 USD,compass-knit-tee-white-true-navy-stripe,https://cdn.shoplightspeed.com/shops/651012/files/70055776/compassknittee-white-truenavystripe-102212-101-c1.webp,,66894147
66894137,Dealmaker Pants- Heather Chambray,Dealmaker Pants- Heather Chambray,in stock,new,128.00 USD,dealmaker-pants-heather-chambray,https://cdn.shoplightspeed.com/shops/651012/files/70055766/screenshot-2025-03-01-at-35112pm.png,,66894137
66894123,Dealmaker Pants- Ash,Dealmaker Pants- Ash,in stock,new,128.00 USD,dealmaker-pants-ash,https://cdn.shoplightspeed.com/shops/651012/files/70055762/screenshot-2025-03-01-at-34633pm.png,,66894123
66894048,Presley tee- true black,Presley tee- true black,in stock,new,68.00 USD,presley-tee-true-black,https://cdn.shoplightspeed.com/shops/651012/files/70055677/screen-shot-2024-05-21-at-53635-pm.png,,66894048
66894045,Mick Tee- heather grey,Mick Tee- heather grey,in stock,new,68.00 USD,mick-tee-heather-grey,https://cdn.shoplightspeed.com/shops/651012/files/70055672/screen-shot-2024-05-21-at-60116-pm.png,,66894045
66894044,Dealmaker Pants- Navy,Dealmaker Pants- Navy,in stock,new,128.00 USD,dealmaker-pants-navy,https://cdn.shoplightspeed.com/shops/651012/files/70055666/screen-shot-2024-05-28-at-101313-pm.png,,66894044
66894041,Dealmaker Pants- Silver Sage,Dealmaker Pants- Silver Sage,in stock,new,128.00 USD,dealmaker-pants-silver-sage,https://cdn.shoplightspeed.com/shops/651012/files/70055661/screen-shot-2024-05-28-at-102038-pm.png,,66894041
66894040,7' COMMUTER SHORT- STONE,7' COMMUTER SHORT- STONE,in stock,new,98.00 USD,7-commuter-short-stone,https://cdn.shoplightspeed.com/shops/651012/files/70055655/screen-shot-2024-05-29-at-55131-pm.png,,66894040
66894039,7.5' R&R TRUNK- FROZEN FJORD BLUE,7.5' R&R TRUNK- FROZEN FJORD BLUE,in stock,new,88.00 USD,75-r-r-trunk-frozen-fjord-blue,https://cdn.shoplightspeed.com/shops/651012/files/70090734/screenshot-2025-05-02-at-85411pm.png,,66894039
66894034,Athletic Association- Navy Hat,Athletic Association- Navy Hat,in stock,new,42.00 USD,athletic-association-navy-hat,https://cdn.shoplightspeed.com/shops/651012/files/70055650/screen-shot-2024-07-05-at-121807-pm.png,,66894034
66894027,Daymaker Pants- Navy,Daymaker Pants- Navy,in stock,new,108.00 USD,daymaker-pants-navy,https://cdn.shoplightspeed.com/shops/651012/files/70055640/screen-shot-2024-07-22-at-75035-am.png,,66894027
66894024,Go-to Henley Short Sleeve- cypress,Go-to Henley Short Sleeve- cypress,in stock,new,68.00 USD,go-to-henley-short-sleeve-cypress,https://cdn.shoplightspeed.com/shops/651012/files/70055638/screen-shot-2024-07-22-at-80104-am.png,,66894024
66894011,Legend Sweater Shirt- Desert Plains Plaid,Legend Sweater Shirt- Desert Plains Plaid,in stock,new,178.00 USD,legend-sweater-shirt-desert-plains-plaid,https://cdn.shoplightspeed.com/shops/651012/files/70055625/screen-shot-2024-12-02-at-101635-pm.png,,66894011
66894009,Classic Stretch Selvage Shirt- Natural,Classic Stretch Selvage Shirt- Natural,in stock,new,118.00 USD,classic-stretch-selvage-shirt-natural,https://cdn.shoplightspeed.com/shops/651012/files/70055621/screenshot-2025-01-17-at-112658am.png,,66894009
66894006,Signature Sea Change Crew Tee- Soft Chambray,Signature Sea Change Crew Tee- Soft Chambray,in stock,new,45.00 USD,signature-sea-change-crew-tee-soft-chambray,https://cdn.shoplightspeed.com/shops/651012/files/70055619/s1-m-signature-sea-change-crew-tee-grey-mist-22401.webp,,66894006
66893999,Signature Jacquard Crew Tee- Natural,Signature Jacquard Crew Tee- Natural,in stock,new,54.00 USD,signature-jacquard-crew-tee-natural,https://cdn.shoplightspeed.com/shops/651012/files/70055612/screenshot-2025-04-03-at-91448am.png,,66893999
66893996,Vintage Heavy Slub Raglan- North Atlantic,Vintage Heavy Slub Raglan- North Atlantic,in stock,new,88.00 USD,vintage-heavy-slub-raglan-north-atlantic,https://cdn.shoplightspeed.com/shops/651012/files/70055610/screenshot-2025-01-17-at-112248am.png,,66893996
66893993,Pacifica Stretch Twill Shirt- Vetiver,Pacifica Stretch Twill Shirt- Vetiver,in stock,new,138.00 USD,pacifica-stretch-twill-shirt-vetiver,https://cdn.shoplightspeed.com/shops/651012/files/70055606/screen-shot-2025-01-09-at-122854-pm.png,,66893993
66893987,Crosstown Bomber-  Black,Crosstown Bomber-  Black,in stock,new,128.00 USD,crosstown-bomber-black,https://cdn.shoplightspeed.com/shops/651012/files/70055594/screenshot-2025-01-23-at-13428pm.png,,66893987
