id,title,description,availability,condition,price,link,image_link,brand,item_group_id
67125839,Greyson Sweater Polo- White,Greyson Sweater Polo- White,in stock,new,118.00 USD,greyson-sweater-polo-white,https://cdn.shoplightspeed.com/shops/651012/files/70442904/screenshot-2025-05-24-at-120255pm.png,,67125839
67125816,Greyson Sweater Polo- India Ink,Greyson Sweater Polo- India Ink,in stock,new,118.00 USD,greyson-sweater-polo-india-ink,https://cdn.shoplightspeed.com/shops/651012/files/70442864/screenshot-2025-05-24-at-115925am.png,,67125816
67125727,Coastline Knit Shirt- Hidden Lake Plaid,Coastline Knit Shirt- Hidden Lake Plaid,out of stock,new,168.00 USD,coastline-knit-shirt-hidden-lake-plaid,https://cdn.shoplightspeed.com/shops/651012/files/70442714/screenshot-2025-05-24-at-114832am.png,,67125727
67125679,SS Palma Linen Camp Shirt- Sienna Valley Stripe,SS Palma Linen Camp Shirt- Sienna Valley Stripe,out of stock,new,168.00 USD,ss-palma-linen-camp-shirt-sienna-valley-stripe,https://cdn.shoplightspeed.com/shops/651012/files/70442628/screenshot-2025-05-24-at-114128am.png,,67125679
67125523,SS Breeze Shirt- Stormy Sea Floral,SS Breeze Shirt- Stormy Sea Floral,out of stock,new,158.00 USD,ss-breeze-shirt-stormy-sea-floral,https://cdn.shoplightspeed.com/shops/651012/files/70442315/screenshot-2025-05-24-at-105700am.png,,67125523
67125420,Supima Oxford Shirt- Pure White,Supima Oxford Shirt- Pure White,out of stock,new,128.00 USD,supima-oxford-shirt-pure-white,https://cdn.shoplightspeed.com/shops/651012/files/70442063/screenshot-2025-05-24-at-105116am.png,,67125420
67125392,SS Movement Shirt- Horizon Bloom,SS Movement Shirt- Horizon Bloom,out of stock,new,148.00 USD,ss-movement-shirt-horizon-bloom,https://cdn.shoplightspeed.com/shops/651012/files/70441998/screenshot-2025-05-24-at-104800am.png,,67125392
67125381,The Movement Shirt- Verona Island Plaid,The Movement Shirt- Verona Island Plaid,out of stock,new,158.00 USD,the-movement-shirt-verona-island-plaid,https://cdn.shoplightspeed.com/shops/651012/files/70441973/screenshot-2025-05-24-at-104318am.png,,67125381
67116037,Revolver Jade Racerback Bra- Black,Revolver Jade Racerback Bra- Black,in stock,new,89.99 USD,revolver-jade-racerback-bra-black,https://cdn.shoplightspeed.com/shops/651012/files/70424326/screenshot-2025-04-17-at-91339am.png,,67116037
67116036,Revolver 25IN Midi Pant- Black,Revolver 25IN Midi Pant- Black,in stock,new,119.99 USD,revolver-25in-midi-pant-black,https://cdn.shoplightspeed.com/shops/651012/files/70424320/screenshot-2025-04-17-at-90853am.png,,67116036
67100754,SS Sunwashed Henley- White,SS Sunwashed Henley- White,out of stock,new,78.00 USD,ss-sunwashed-henley-white,https://cdn.shoplightspeed.com/shops/651012/files/70390616/screenshot-2025-05-21-at-32641pm.png,,67100754
67100523,Routine Ribbed Biker Jumpsuit- Black Onyx,Routine Ribbed Biker Jumpsuit- Black Onyx,out of stock,new,108.00 USD,routine-ribber-biker-jumpsuit-black-onyx,https://cdn.shoplightspeed.com/shops/651012/files/70389967/screenshot-2025-05-21-at-31727pm.png,,67100523
67098872,Studio Siren Pant- Heather Grey,Studio Siren Pant- Heather Grey,in stock,new,108.00 USD,studio-siren-pant-heather-grey,https://cdn.shoplightspeed.com/shops/651012/files/70385412/screenshot-2025-05-21-at-20927pm.png,,67098872
67098393,All Clear Cami- Seafoam,All Clear Cami- Seafoam,in stock,new,30.00 USD,all-clear-cami-seafoam,https://cdn.shoplightspeed.com/shops/651012/files/70384412/screenshot-2025-05-21-at-14546pm.png,,67098393
67098064,Gym Sock- Blue Sunset Stripe,Gym Sock- Blue Sunset Stripe,in stock,new,15.00 USD,gym-sock-blue-sunset-stripe,https://cdn.shoplightspeed.com/shops/651012/files/70384047/screenshot-2025-05-21-at-13843pm.png,,67098064
67098018,"Saturday Seersucker Short 6""- Light Indigo","Saturday Seersucker Short 6""- Light Indigo",in stock,new,98.00 USD,saturday-seersucker-short-6-light-indigo,https://cdn.shoplightspeed.com/shops/651012/files/70383912/screenshot-2025-05-21-at-13420pm.png,,67098018
67097967,Air Pocket Polo- Withered Rose,Air Pocket Polo- Withered Rose,in stock,new,88.00 USD,air-pocket-polo-withered-rose,https://cdn.shoplightspeed.com/shops/651012/files/70383770/screenshot-2025-05-21-at-13228pm.png,,67097967
67093362,Stretch Terry 5Pocket - Desert Khaki,Stretch Terry 5Pocket- Desert Khaki,out of stock,new,178.00 USD,stretch-terry-5pocket-desert-khaki,https://cdn.shoplightspeed.com/shops/651012/files/70405550/terrypocket5.webp,,67093362
67087529,Airweight Bra With Ruching- White,Airweight Bra With Ruching- White,in stock,new,88.00 USD,airweight-bra-with-ruching-white,https://cdn.shoplightspeed.com/shops/651012/files/70368703/screenshot-2025-05-20-at-81307pm.png,,67087529
67087474,Austin Rigor Dress- White/Indigo,Austin Rigor Dress- White/Indigo,in stock,new,168.00 USD,austin-rigor-dress-white-indigo,https://cdn.shoplightspeed.com/shops/651012/files/70368651/screenshot-2025-05-20-at-81023pm.png,,67087474
67087385,Airweight Bomber Jacket- White,Airweight Bomber Jacket- White,in stock,new,158.00 USD,airweight-bomber-jacket-white,https://cdn.shoplightspeed.com/shops/651012/files/70368612/screenshot-2025-05-20-at-80938pm.png,,67087385
67086787,Miles High Waist Rigor 7/8- Skylight/White,Miles High Waist Rigor 7/8- Skylight/White,in stock,new,138.00 USD,miles-high-waist-rigor-7-8-skylight-white,https://cdn.shoplightspeed.com/shops/651012/files/70368292/screenshot-2025-05-20-at-74140pm.png,,67086787
67086721,Miles Rigor Bra- Skylight/White,Miles Rigor Bra- Skylight/White,in stock,new,82.00 USD,miles-rigor-bra-skylight-white,https://cdn.shoplightspeed.com/shops/651012/files/70368250/screenshot-2025-05-20-at-73948pm.png,,67086721
67073467,Spritz Vintage Cap- Navy,Spritz Vintage Cap- Navy,in stock,new,47.00 USD,spritz-vintage-cap-navy,https://cdn.shoplightspeed.com/shops/651012/files/70348753/screenshot-2025-05-19-at-84432pm.png,,67073467
67073454,Not a Tourist Cap- White,Not a Tourist Cap- White,in stock,new,47.00 USD,not-a-tourist-cap-white,https://cdn.shoplightspeed.com/shops/651012/files/70348743/screenshot-2025-05-19-at-84021pm.png,,67073454
67073452,Negroni Please Cap- Spruce,Negroni Please Cap- Spruce,in stock,new,47.00 USD,negroni-please-cap-spruce,https://cdn.shoplightspeed.com/shops/651012/files/70348738/screenshot-2025-05-19-at-83657pm.png,,67073452
67073445,Jet Lagged Cap- Navy,Jet Lagged Cap- Navy,in stock,new,47.00 USD,jet-lagged-cap-navy,https://cdn.shoplightspeed.com/shops/651012/files/70348733/screenshot-2025-05-19-at-83657pm.png,,67073445
67073435,Champagne Problems Cap- Pink,Champagne Problems Cap- Pink,in stock,new,47.00 USD,champagne-problems-cap-pink,https://cdn.shoplightspeed.com/shops/651012/files/70348721/screenshot-2025-05-19-at-83429pm.png,,67073435
67073428,Late Check Out Cap- Black,Late Check Out Cap- Black,in stock,new,46.00 USD,late-check-out-cap-black,https://cdn.shoplightspeed.com/shops/651012/files/70348710/screenshot-2025-05-19-at-83238pm.png,,67073428
67053767,Never Better Heather Crop- Blueberry Heather,Never Better Heather Crop- Blueberry Heather,in stock,new,34.80 USD,never-better-heather-crop-blueberry-heather,https://cdn.shoplightspeed.com/shops/651012/files/70308355/screen-shot-2024-12-11-at-125012-pm.png,,67053767
67046653,Angelina Skirt Crochet- Onyx,Angelina Skirt Crochet- Onyx,in stock,new,198.00 USD,angelina-skirt-crochet-onyx,https://cdn.shoplightspeed.com/shops/651012/files/70302061/screenshot-2025-05-15-at-95855pm.png,,67046653
67046601,Roberta Top- Crochet Onyx,Roberta Top- Crochet Onyx,in stock,new,158.00 USD,roberta-top-crochet-onyx,https://cdn.shoplightspeed.com/shops/651012/files/70302049/screenshot-2025-05-15-at-95557pm.png,,67046601
67046524,Weylan Dress- Onyx,Weylan Dress- Onyx,out of stock,new,138.00 USD,weylan-dress-onyx,https://cdn.shoplightspeed.com/shops/651012/files/70301994/screenshot-2025-05-15-at-95219pm.png,,67046524
67046412,Addison Dress- Onyx,Addison Dress- Onyx,out of stock,new,238.00 USD,addison-dress-onyx,https://cdn.shoplightspeed.com/shops/651012/files/70301923/screenshot-2025-05-15-at-94458pm.png,,67046412
67046356,Chloe Sweater- Royal,Chloe Sweater- Royal,in stock,new,158.00 USD,chloe-sweater-royal,https://cdn.shoplightspeed.com/shops/651012/files/70301884/screenshot-2025-05-15-at-93744pm.png,,67046356
66983604,Cluster B,Cluster B,out of stock,new,0.00 USD,cluster-b,,,66983604
66983475,Kirsi Half Zip Midlayer- White/Forest,Kirsi Half Zip Midlayer- White/Forest,in stock,new,138.00 USD,kirsi-half-zip-midlayer-white-forest,https://cdn.shoplightspeed.com/shops/651012/files/70307629/screenshot-2025-05-09-at-15156pm.png,,66983475
66982835,Ferns Open Knit Tank- Shadow,Ferns Open Knit Tank- Shadow,in stock,new,88.00 USD,ferns-open-knit-tank-shadow,https://cdn.shoplightspeed.com/shops/651012/files/70202922/screenshot-2025-05-09-at-14901pm.png,,66982835
66982795,Ferns Open Knit Tank- Snow White,Ferns Open Knit Tank- Snow White,in stock,new,88.00 USD,ferns-open-knit-tank-snow-white,https://cdn.shoplightspeed.com/shops/651012/files/70202836/screenshot-2025-05-09-at-14547pm.png,,66982795
66982750,Athena Pointelle Knit Vest- Egret,Athena Pointelle Knit Vest- Egret,in stock,new,110.00 USD,athena-pointelle-knit-vest-egret,https://cdn.shoplightspeed.com/shops/651012/files/70202715/screenshot-2025-05-09-at-14122pm.png,,66982750
66982708,Scott Scoop Neck Midi Dress- Birch,Scott Scoop Neck Midi Dress- Birch,in stock,new,178.00 USD,scott-scoop-neck-midi-dress-birch,https://cdn.shoplightspeed.com/shops/651012/files/70307601/screenshot-2025-05-09-at-13817pm.png,,66982708
66980223,Archive Tencel Linen Resort Shirt- Navy Happy Hour Print,Archive Tencel Linen Resort Shirt- Navy Happy Hour Print,out of stock,new,118.00 USD,archive-tencel-linen-resort-shirt-navy-happy-hour,https://cdn.shoplightspeed.com/shops/651012/files/70196260/screenshot-2025-05-09-at-95242am.png,,66980223
66980200,Greyson Sweater Polo- Topaz,Greyson Sweater Polo- Topaz,out of stock,new,118.00 USD,greyson-sweater-polo-topaz,https://cdn.shoplightspeed.com/shops/651012/files/70196205/screenshot-2025-05-09-at-94909am.png,,66980200
66980176,Archive Cyrus Sweater Polo- Natural,Archive Cyrus Sweater Polo- Natural,out of stock,new,128.00 USD,archive-cyrus-sweater-polo-natural,https://cdn.shoplightspeed.com/shops/651012/files/70196151/screenshot-2025-05-09-at-94555am.png,,66980176
66980136,Archive Cam Jacquard Resort Shirt- Neutral Geo,Archive Cam Jacquard Resort Shirt- Neutral Geo,out of stock,new,108.00 USD,archive-cam-jacquard-resort-shirt-neutral-geo,https://cdn.shoplightspeed.com/shops/651012/files/70196085/screenshot-2025-05-09-at-94313am.png,,66980136
66980114,Mabel Shirt- Strawberry Stand Terry,Mabel Shirt- Strawberry Stand Terry,in stock,new,98.00 USD,mabel-shirt-strawberry-stand-terry,https://cdn.shoplightspeed.com/shops/651012/files/70196036/screenshot-2025-05-09-at-93706am.png,,66980114
66980102,Kiara Short- Strawberry Stand Terry,Kiara Short- Strawberry Stand Terry,in stock,new,88.00 USD,kiara-short-strawberry-stand-terry,https://cdn.shoplightspeed.com/shops/651012/files/70195991/screenshot-2025-05-09-at-93706am.png,,66980102
66980071,Camilla Top  & Highway Bottom Set- Strawberry Stand Terry,Camilla Top  & Highway Bottom Set- Strawberry Stand Terry,in stock,new,206.00 USD,camilla-top-highway-bottom-set-strawberry-stand-te,https://cdn.shoplightspeed.com/shops/651012/files/70195933/screenshot-2025-05-09-at-92808am.png,,66980071
66980039,Priscilla One Piece- Fruit Market,Priscilla One Piece- Fruit Market,in stock,new,158.00 USD,priscilla-one-piece-fruit-market,https://cdn.shoplightspeed.com/shops/651012/files/70195844/screenshot-2025-05-09-at-92544am.png,,66980039
66980017,Righteous Runsie- Clove,Righteous Runsie- Clove,in stock,new,98.00 USD,righteous-runsie-clove,https://cdn.shoplightspeed.com/shops/651012/files/70195800/screenshot-2025-05-09-at-92151am.png,,66980017
66946838,Phoebe Bikini- Black,Phoebe Bikini- Black,in stock,new,295.00 USD,phoebe-bikini-black,https://cdn.shoplightspeed.com/shops/651012/files/70149926/screenshot-2025-05-07-at-81949am.png,,66946838
66946837,Osiris Frill Bikini- Navy,Osiris Frill Bikini- Navy,in stock,new,295.00 USD,osiris-frill-bikini-navy,https://cdn.shoplightspeed.com/shops/651012/files/70149920/screenshot-2025-05-07-at-81729am.png,,66946837
66946833,Domino Swim- Metallic Cocoa,Domino Swim- Metallic Cocoa,in stock,new,255.00 USD,domino-swim-metallic-cocoa,https://cdn.shoplightspeed.com/shops/651012/files/70149914/screenshot-2025-05-07-at-81559am.png,,66946833
66946830,Camille Swim- Metallic Kahki,Camille Swim- Metallic Kahki,in stock,new,295.00 USD,camille-swim-metallic-kahki,https://cdn.shoplightspeed.com/shops/651012/files/70149896/screenshot-2025-05-07-at-81259am.png,,66946830
66946828,Camille Swim- Metallic Rosewood,Camille Swim- Metallic Rosewood,in stock,new,295.00 USD,camille-swim-metallic-rosewood,https://cdn.shoplightspeed.com/shops/651012/files/70149890/screenshot-2025-05-07-at-81006am.png,,66946828
66946824,Square Neck Swim- Metallic Cocoa,Square Neck Swim- Metallic Cocoa,in stock,new,240.00 USD,square-neck-swim-metallic-cocoa,https://cdn.shoplightspeed.com/shops/651012/files/70149857/screenshot-2025-05-07-at-80644am.png,,66946824
66946817,Domino Swim- Blush,Domino Swim- Blush,in stock,new,255.00 USD,domino-swim-blush,https://cdn.shoplightspeed.com/shops/651012/files/70149840/screenshot-2025-05-07-at-80339am.png,,66946817
66946811,Camille One Piece- Red,Camille One Piece- Red,in stock,new,295.00 USD,camille-one-piece-red,https://cdn.shoplightspeed.com/shops/651012/files/70149812/screenshot-2025-05-07-at-75806am.png,,66946811
66931094,Jolie Hoodie- Ivory,Jolie Hoodie- Ivory,in stock,new,168.00 USD,jolie-hoodie-ivory,https://cdn.shoplightspeed.com/shops/651012/files/70123175/screenshot-2025-04-16-at-44338pm.png,,66931094
66931082,Polo Sweater- Lavender,Polo Sweater- Lavender,out of stock,new,148.00 USD,polo-sweater-lavender,https://cdn.shoplightspeed.com/shops/651012/files/70123167/screenshot-2025-04-16-at-44848pm.png,,66931082
66931055,Easy Pant- Indigo Stripe,Easy Pant- Indigo Stripe,in stock,new,218.00 USD,easy-pant-indigo-stripe,https://cdn.shoplightspeed.com/shops/651012/files/70123149/screenshot-2025-04-16-at-44527pm.png,,66931055
66931003,Classic Sweatshirt-Peace Out- Apricot,Classic Sweatshirt-Peace Out- Apricot,in stock,new,178.00 USD,classic-sweatshirt-peace-out-apricot,https://cdn.shoplightspeed.com/shops/651012/files/70123098/screenshot-2025-04-16-at-43841pm.png,,66931003
66911071,Bathing Suit- Shark Kings,Bathing Suit- Shark Kings,in stock,new,79.00 USD,bathing-suit-shark-kings,https://cdn.shoplightspeed.com/shops/651012/files/70085149/screenshot-2025-05-02-at-35837pm.png,,66911071
66910842,"Khaki Shorts 7""- April Big Cannons","Khaki Shorts 7""- April Big Cannons",in stock,new,69.00 USD,khaki-shorts-7-april-big-cannons,https://cdn.shoplightspeed.com/shops/651012/files/70084819/screenshot-2025-05-02-at-34933pm.png,,66910842
66910585,"Khaki Shorts 7""- Buzz Lightbeer","Khaki Shorts 7""- Buzz Lightbeer",in stock,new,69.00 USD,khaki-shorts-buzz-lightbeer,https://cdn.shoplightspeed.com/shops/651012/files/70084570/screenshot-2025-05-02-at-34245pm.png,,66910585
66905986,Spacedye Slim Racerback Crop Tank,Spacedye Slim Racerback Crop Tank,in stock,new,68.00 USD,spacedye-slim-racerback-crop-tank,https://cdn.shoplightspeed.com/shops/651012/files/70077821/sd4382-candy-apple-red-heather-07416.webp,,66905986
66905810,Spacedye On The Up Crop Tank,Spacedye On The Up Crop Tank,in stock,new,74.00 USD,spacedye-on-the-up-crop-tank,https://cdn.shoplightspeed.com/shops/651012/files/70077455/sd4712-darkest-night-16036.webp,,66905810
66905739,Spacedye Starting Line Dress- Darkest Night,Spacedye Starting Line Dress- Darkest Night,in stock,new,128.00 USD,spacedye-starting-line-dress-darkest-night,https://cdn.shoplightspeed.com/shops/651012/files/70077341/sd6283-darkest-night-cloud-white-4399.webp,,66905739
66894819,movement quarter zip- blue nights,movement quarter zip- blue nights,in stock,new,88.80 USD,movement-quarter-zip-blue-nights,https://cdn.shoplightspeed.com/shops/651012/files/70056764/screen-shot-2024-05-28-at-92816-pm.png,,66894819
66894814,"belt loop all day shorts (5"")- ice grey","belt loop all day shorts (5"")- ice grey",in stock,new,98.00 USD,belt-loop-all-day-shorts-5-ice-grey,https://cdn.shoplightspeed.com/shops/651012/files/70056757/screen-shot-2024-06-12-at-70349-pm.png,,66894814
66894812,7' PURSUIT SHORT - UNLINED- Black,7' PURSUIT SHORT - UNLINED- Black,out of stock,new,74.00 USD,7-pursuit-short-unlined-black,https://cdn.shoplightspeed.com/shops/651012/files/70056745/screen-shot-2024-06-10-at-93225-pm.png,,66894812
66894809,Commuter Short Sleeve Button Down- Blue,Commuter Short Sleeve Button Down- Blue,in stock,new,70.80 USD,commuter-short-sleeve-button-down-blue,https://cdn.shoplightspeed.com/shops/651012/files/70056741/screen-shot-2024-05-29-at-52656-pm.png,,66894809
66894806,7' COMMUTER SHORT- Iron,7' COMMUTER SHORT- Iron,in stock,new,58.80 USD,7-commuter-short-iron,https://cdn.shoplightspeed.com/shops/651012/files/70056737/screen-shot-2024-06-10-at-91318-pm.png,,66894806
66894805,7' COMMUTER SHORT- Black,7' COMMUTER SHORT- Black,in stock,new,98.00 USD,7-commuter-short-black,https://cdn.shoplightspeed.com/shops/651012/files/70056733/screen-shot-2024-06-10-at-91142-pm.png,,66894805
66894800,7.5' R&R TRUNK- CROSS STITCH STRIPE,7.5' R&R TRUNK- CROSS STITCH STRIPE,in stock,new,98.00 USD,75-r-r-trunk-cross-stitch-stripe,https://cdn.shoplightspeed.com/shops/651012/files/70056719/screen-shot-2024-05-29-at-62609-pm.png,,66894800
66894795,7' PURSUIT SHORT - UNLINED- ASPHALT,7' PURSUIT SHORT - UNLINED- ASPHALT,in stock,new,74.00 USD,7-pursuit-short-unlined-asphalt,https://cdn.shoplightspeed.com/shops/651012/files/70056705/screen-shot-2024-05-29-at-61943-pm.png,,66894795
66894792,TOP FLIGHT VEST- SLEET GRAY,TOP FLIGHT VEST- SLEET GRAY,out of stock,new,128.00 USD,top-flight-vest-sleet-gray,https://cdn.shoplightspeed.com/shops/651012/files/70056699/screen-shot-2024-05-29-at-61122-pm.png,,66894792
66894786,9' MOMENTUM GOLF SHORT- Blue Stone,9' MOMENTUM GOLF SHORT- Blue Stone,in stock,new,108.00 USD,9-momentum-golf-short-blue-stone,https://cdn.shoplightspeed.com/shops/651012/files/70056690/screen-shot-2024-05-29-at-60742-pm.png,,66894786
66894785,7' COMMUTER SHORT- Navy,7' COMMUTER SHORT- Navy,out of stock,new,58.80 USD,7-commuter-short-navy,https://cdn.shoplightspeed.com/shops/651012/files/70056684/screen-shot-2024-05-29-at-60402-pm.png,,66894785
66894782,Dealmaker Pants- Cypress,Dealmaker Pants- Cypress,in stock,new,76.80 USD,dealmaker-pants-cypress,https://cdn.shoplightspeed.com/shops/651012/files/70056675/screen-shot-2024-05-28-at-102525-pm.png,,66894782
66894777,ss sunwashed henley- heather grey,ss sunwashed henley- heather grey,in stock,new,46.80 USD,ss-sunwashed-henley-heather-grey,https://cdn.shoplightspeed.com/shops/651012/files/70090791/screenshot-2025-05-02-at-85805pm.png,,66894777
66894774,Mick Tee- true black,Mick Tee- true black,in stock,new,68.00 USD,mick-tee-true-black,https://cdn.shoplightspeed.com/shops/651012/files/70056669/screen-shot-2024-05-21-at-55910-pm.png,,66894774
66894773,Tommy structured fleece hooded sweatshirt- sand dune,Tommy structured fleece hooded sweatshirt- sand dune,in stock,new,134.40 USD,tommy-structured-fleece-hooded-sweatshirt-sand-dun,https://cdn.shoplightspeed.com/shops/651012/files/70056666/screen-shot-2024-05-21-at-54839-pm.png,,66894773
66894766,REC FLC TAPERED SWEATPANT- Black,REC FLC TAPERED SWEATPANT- Black,in stock,new,76.00 USD,rec-flc-tapered-sweatpant-black,https://cdn.shoplightspeed.com/shops/651012/files/70056652/screen-shot-2024-05-20-at-95751-pm.png,,66894766
66894763,Pivotal Performance Short- Graphite,Pivotal Performance Short- Graphite,in stock,new,46.80 USD,pivotal-performance-short-graphite,https://cdn.shoplightspeed.com/shops/651012/files/70090682/screenshot-2025-05-02-at-84957pm.png,,66894763
66894762,EVERY BODY ZIP FRONT HOODIE- Fresh Snow,EVERY BODY ZIP FRONT HOODIE- Fresh Snow,in stock,new,82.80 USD,every-body-zip-front-hoodie-fresh-snow,https://cdn.shoplightspeed.com/shops/651012/files/70056645/screen-shot-2024-02-26-at-20553-pm.png,,66894762
66894760,PIVOTAL PERFORMANCE LINED SHORT- CERULEAN NAVY,PIVOTAL PERFORMANCE LINED SHORT- CERULEAN NAVY,in stock,new,52.80 USD,pivotal-performance-lined-short-cerulean-navy,https://cdn.shoplightspeed.com/shops/651012/files/70090713/screenshot-2025-05-02-at-85116pm.png,,66894760
66894749,REC FLC SWEATSHIRT- mineral moonlit ocean,REC FLC SWEATSHIRT- mineral moonlit ocean,in stock,new,76.00 USD,rec-flc-sweatshirt-mineral-moonlit-ocean,https://cdn.shoplightspeed.com/shops/651012/files/70056635/screen-shot-2024-05-20-at-100553-pm.png,,66894749
66894747,"beacon trunk (7"")- fish scale batik","beacon trunk (7"")- fish scale batik",in stock,new,98.00 USD,beacon-trunk-7-fish-scale-batik,https://cdn.shoplightspeed.com/shops/651012/files/70056629/screen-shot-2024-06-18-at-90621-pm.png,,66894747
66894743,movement quarter zip- mountain grey feeder stripe,movement quarter zip- mountain grey feeder stripe,in stock,new,88.80 USD,movement-quarter-zip-mountain-grey-feeder-stripe,https://cdn.shoplightspeed.com/shops/651012/files/70056628/screen-shot-2024-05-28-at-92935-pm.png,,66894743
66894739,WOODLAND SCUBA FULL ZIP- Black,WOODLAND SCUBA FULL ZIP- Black,in stock,new,96.00 USD,woodland-scuba-full-zip-black,https://cdn.shoplightspeed.com/shops/651012/files/70056613/screen-shot-2024-06-21-at-31550-pm.png,,66894739
66894735,TOP FLIGHT VEST- Asphalt,TOP FLIGHT VEST- Asphalt,out of stock,new,128.00 USD,top-flight-vest-asphalt,https://cdn.shoplightspeed.com/shops/651012/files/70056603/topflightvest-asphalt-0003-900x.webp,,66894735
66894734,Go-to Polo- Stone,Go-to Polo- Stone,in stock,new,43.20 USD,go-to-polo-stone,https://cdn.shoplightspeed.com/shops/651012/files/70056602/screen-shot-2024-05-28-at-101151-pm.png,,66894734
66894733,Go-to Polo- Heather Silver Spoon,Go-to Polo- Heather Silver Spoon,in stock,new,72.00 USD,go-to-polo-heather-silver-spoon,https://cdn.shoplightspeed.com/shops/651012/files/70056600/screen-shot-2024-05-28-at-100931-pm.png,,66894733
66894727,Pique Tee Dress- White,Pique Tee Dress- White,in stock,new,65.00 USD,pique-tee-dress-white,https://cdn.shoplightspeed.com/shops/651012/files/70056595/screen-shot-2024-06-28-at-102308-am.png,,66894727
66894723,Pique Tee- Heather Grey,Pique Tee- Heather Grey,in stock,new,65.00 USD,pique-tee-heather-grey,https://cdn.shoplightspeed.com/shops/651012/files/70056583/screen-shot-2024-06-28-at-102651-am.png,,66894723
66894714,Pique Tee- Jet Black,Pique Tee- Jet Black,in stock,new,65.00 USD,pique-tee-jet-black,https://cdn.shoplightspeed.com/shops/651012/files/70056575/screen-shot-2024-06-28-at-103006-am.png,,66894714
66894711,Pique Tee- Navy,Pique Tee- Navy,in stock,new,65.00 USD,pique-tee-navy,https://cdn.shoplightspeed.com/shops/651012/files/70056569/screen-shot-2024-06-28-at-103220-am.png,,66894711
66894710,TREK SHIRT- CARBON/BLACK BUFFALO PLAID,TREK SHIRT- CARBON/BLACK BUFFALO PLAID,in stock,new,58.80 USD,trek-shirt-carbon-black-buffalo-plaid,https://cdn.shoplightspeed.com/shops/651012/files/70056566/screen-shot-2024-07-05-at-115118-am.png,,66894710
66894704,7' INVICTUS RIPSTOP SHORT - UNLINED- OLIVINE,7' INVICTUS RIPSTOP SHORT - UNLINED- OLIVINE,in stock,new,50.40 USD,7-invictus-ripstop-short-unlined-olivine,https://cdn.shoplightspeed.com/shops/651012/files/70056559/screen-shot-2024-07-21-at-32116-pm.png,,66894704
66894696,GOLF SPORT POLO- SEAGRASS GREEN,GOLF SPORT POLO- SEAGRASS GREEN,in stock,new,78.40 USD,golf-sport-polo-seagrass-green,https://cdn.shoplightspeed.com/shops/651012/files/70056549/screen-shot-2024-07-21-at-33438-pm.png,,66894696
66894689,INVICTUS RIPSTOP ANORAK- Black,INVICTUS RIPSTOP ANORAK- Black,in stock,new,148.00 USD,invictus-ripstop-anorak-black,https://cdn.shoplightspeed.com/shops/651012/files/70056539/screen-shot-2024-07-21-at-33833-pm.png,,66894689
66894685,Go-to Henley Short Sleeve- HEATHER SILVER SPOON,Go-to Henley Short Sleeve- HEATHER SILVER SPOON,in stock,new,68.00 USD,go-to-henley-short-sleeve-heather-silver-spoon,https://cdn.shoplightspeed.com/shops/651012/files/70056525/screen-shot-2024-07-22-at-75838-am.png,,66894685
66894682,Go-to Henley- Black,Go-to Henley- Black,in stock,new,46.80 USD,go-to-henley-black,https://cdn.shoplightspeed.com/shops/651012/files/70056516/screen-shot-2024-07-24-at-120433-pm.png,,66894682
66894679,Stretch Terry 5-Pocket Pant- Stone,Stretch Terry 5-Pocket Pant- Stone,in stock,new,178.00 USD,stretch-terry-5-pocket-pant-stone,https://cdn.shoplightspeed.com/shops/651012/files/70056512/screen-shot-2024-07-28-at-80620-pm.png,,66894679
66894676,Go-to Henley- Heather Charcoal,Go-to Henley- Heather Charcoal,in stock,new,46.80 USD,go-to-henley-heather-charcoal,https://cdn.shoplightspeed.com/shops/651012/files/70056502/screen-shot-2024-08-10-at-24907-pm.png,,66894676
66894662,Sunwashed Tee- Washed Black,Sunwashed Tee- Washed Black,in stock,new,58.00 USD,sunwashed-tee-washed-black,https://cdn.shoplightspeed.com/shops/651012/files/70056493/screen-shot-2024-08-18-at-83805-pm.png,,66894662
66894658,Atlas Hoodie- Black,Atlas Hoodie- Black,in stock,new,88.00 USD,atlas-hoodie-black,https://cdn.shoplightspeed.com/shops/651012/files/70056488/screen-shot-2024-08-28-at-90929-am.png,,66894658
66894654,REC FLC Tapered Sweatpant- Mineral Moonlit Ocean,REC FLC Tapered Sweatpant- Mineral Moonlit Ocean,in stock,new,76.00 USD,rec-flc-tapered-sweatpant-mineral-moonlit-ocean,https://cdn.shoplightspeed.com/shops/651012/files/70056480/screen-shot-2024-09-15-at-22835-pm.png,,66894654
