id,title,description,availability,condition,price,link,image_link,brand,item_group_id
66893984,Go-To Henley- Heather Silver Spoon,Go-To Henley- Heather Silver Spoon,in stock,new,78.00 USD,go-to-henley-heather-silver-spoon,https://cdn.shoplightspeed.com/shops/651012/files/70055587/public-rec-henleys-go-to-long-sleeve-henley-men-s.webp,,66893984
66893979,Marl Crew Sweater- Topaz,Marl Crew Sweater- Topaz,in stock,new,138.00 USD,marl-crew-sweater-topaz,https://cdn.shoplightspeed.com/shops/651012/files/70055575/screen-shot-2025-02-05-at-113454-am.png,,66893979
66893974,Movement Monterrey Shirt- Bristol Shores Plaid,Movement Monterrey Shirt- Bristol Shores Plaid,in stock,new,168.00 USD,movement-monterrey-shirt-bristol-shores-plaid,https://cdn.shoplightspeed.com/shops/651012/files/70055559/screenshot-2025-04-03-at-90603am.png,,66893974
66893965,Movement Monterrey Shirt- Willow Creek Plaid,Movement Monterrey Shirt- Willow Creek Plaid,in stock,new,168.00 USD,movement-monterrey-shirt-willow-creek-plaid,https://cdn.shoplightspeed.com/shops/651012/files/70055543/screenshot-2025-04-03-at-90753am.png,,66893965
66893962,Reign Short Sleeve- Tidal Green,Reign Short Sleeve- Tidal Green,in stock,new,68.00 USD,reign-short-sleeve-tidal-green,https://cdn.shoplightspeed.com/shops/651012/files/70055537/reignshortsleeve-tidalgreen-100305-355-c1-1500x.webp,,66893962
66893960,Embroidered Resort Shirt- Natural,Embroidered Resort Shirt- Natural,in stock,new,138.00 USD,embroidered-resort-shirt-natural,https://cdn.shoplightspeed.com/shops/651012/files/70055536/screenshot-2025-02-26-at-42911pm.png,,66893960
66893954,Breeze Saturday Chino- India Ink,Breeze Saturday Chino- India Ink,in stock,new,128.00 USD,breeze-saturday-chino-india-ink,https://cdn.shoplightspeed.com/shops/651012/files/70055521/screenshot-2025-02-26-at-44437pm.png,,66893954
66893951,Liam Sweater Polo- Navy/Cream,Liam Sweater Polo- Navy/Cream,in stock,new,118.00 USD,liam-sweater-polo-navy-cream,https://cdn.shoplightspeed.com/shops/651012/files/70055518/screenshot-2025-02-26-at-45210pm.png,,66893951
66893945,"Saturday Beach Short 6""- Navy Texture","Saturday Beach Short 6""- Navy Texture",in stock,new,88.00 USD,saturday-beach-short-6-navy-texture,https://cdn.shoplightspeed.com/shops/651012/files/70055511/screenshot-2025-02-26-at-50029pm.png,,66893945
66893938,"Lined Sport & Swim Short 6""- Navy/Blue Stripe","Lined Sport & Swim Short 6""- Navy/Blue Stripe",in stock,new,94.00 USD,lined-sport-swim-short-6-navy-blue-stripe,https://cdn.shoplightspeed.com/shops/651012/files/70055503/s10-s3-vintage-heavy-slub-button-down-saturday-sho.webp,,66893938
66893937,"Lined Sport & Swim Short 6""- Japanese Wave Print","Lined Sport & Swim Short 6""- Japanese Wave Print",out of stock,new,94.00 USD,lined-sport-swim-short-6-japanese-wave-print,https://cdn.shoplightspeed.com/shops/651012/files/70055495/s2-m-18777-swim-trunk-w-liner-6-japanese-wave-prin.webp,,66893937
66893935,Breeze Blazer- India Ink,Breeze Blazer- India Ink,in stock,new,178.00 USD,breeze-blazer-india-ink,https://cdn.shoplightspeed.com/shops/651012/files/70055482/screenshot-2025-02-26-at-51308pm.png,,66893935
66893933,Always Beyond Pullover Crew- Black,Always Beyond Pullover Crew- Black,in stock,new,99.00 USD,always-beyond-pullover-crew-black,https://cdn.shoplightspeed.com/shops/651012/files/70055472/mb7799d-black-0849.webp,,66893933
66893930,Signature Sea Change Crew Tee- Vintage Indigo,Signature Sea Change Crew Tee- Vintage Indigo,in stock,new,45.00 USD,signature-sea-change-crew-tee-vintage-indigo,https://cdn.shoplightspeed.com/shops/651012/files/70055471/screenshot-2025-03-21-at-25754pm.png,,66893930
66893926,"Saturday Beach Short 6""- Faded Black","Saturday Beach Short 6""- Faded Black",in stock,new,88.00 USD,saturday-beach-short-6-faded-black,https://cdn.shoplightspeed.com/shops/651012/files/70055466/screenshot-2025-03-21-at-30129pm.png,,66893926
66893921,Vintage Heavy Slub Button Down- White,Vintage Heavy Slub Button Down- White,in stock,new,88.00 USD,vintage-heavy-slub-button-down-white,https://cdn.shoplightspeed.com/shops/651012/files/70055461/screenshot-2025-03-21-at-33941pm.png,,66893921
66893918,Air Pocket Polo- Vintage Indigo,Air Pocket Polo- Vintage Indigo,in stock,new,88.00 USD,air-pocket-polo-vintage-indigo,https://cdn.shoplightspeed.com/shops/651012/files/70090830/screenshot-2025-05-02-at-90147pm.png,,66893918
66893911,Asher Sweater Resort Shirt- Light Aqua,Asher Sweater Resort Shirt- Light Aqua,in stock,new,138.00 USD,asher-sweater-resort-shirt-light-aqua,https://cdn.shoplightspeed.com/shops/651012/files/70055456/screenshot-2025-04-28-at-23939pm.png,,66893911
66893908,Portola Beach Hoodie- Navy/Natural Stripe,Portola Beach Hoodie- Navy/Natural Stripe,in stock,new,118.00 USD,portola-beach-hoodie-navy-natural-stripe,https://cdn.shoplightspeed.com/shops/651012/files/70055446/screenshot-2025-04-28-at-24246pm.png,,66893908
66893880,"Lined Sport & Swim Short 6""- Mood Indigo","Lined Sport & Swim Short 6""- Mood Indigo",in stock,new,94.00 USD,lined-sport-swim-short-6-mood-indigo,https://cdn.shoplightspeed.com/shops/651012/files/70055427/screenshot-2025-04-28-at-30549pm.png,,66893880
66893878,"Lined Sport & Swim Short 6""- Aqua Agave Print","Lined Sport & Swim Short 6""- Aqua Agave Print",in stock,new,94.00 USD,lined-sport-swim-short-6-aqua-agave-print,https://cdn.shoplightspeed.com/shops/651012/files/70055418/screenshot-2025-04-28-at-31133pm.png,,66893878
66893867,Saturday Stretch Beach Pant- Fog,Saturday Stretch Beach Pant- Fog,in stock,new,128.00 USD,saturday-stretch-beach-pant-fog,https://cdn.shoplightspeed.com/shops/651012/files/70055410/screenshot-2025-02-26-at-50741pm.png,,66893867
66893848,Classic Stretch Selvage Shirt- Blue Mini Stripe,Classic Stretch Selvage Shirt- Blue Mini Stripe,in stock,new,98.00 USD,classic-stretch-selvage-shirt-blue-mini-stripe,https://cdn.shoplightspeed.com/shops/651012/files/70055378/screen-shot-2025-01-02-at-22157-pm.png,,66893848
66884046,Carpe Diem Crew Sock- Canvas/Shell Pink,Carpe Diem Crew Sock- Canvas/Shell Pink,in stock,new,22.00 USD,carpe-diem-crew-sock-canvas-shell-pink,https://cdn.shoplightspeed.com/shops/651012/files/70036699/screenshot-2025-04-30-at-123433pm.png,,66884046
66883989,Lotus 2-Tone 7/8 Legging- Dark Palm,Lotus 2-Tone 7/8 Legging- Dark Palm,in stock,new,118.00 USD,lotus-2-tone-7-8-legging-dark-palm,https://cdn.shoplightspeed.com/shops/651012/files/70036593/screenshot-2025-04-30-at-123205pm.png,,66883989
66883928,Horizon Bra- Cabana Blue,Horizon Bra- Cabana Blue,in stock,new,78.00 USD,horizon-bra-cabana-blue,https://cdn.shoplightspeed.com/shops/651012/files/70036431/screenshot-2025-04-30-at-122729pm.png,,66883928
66883905,Mercury 2-Tone Longline Bra- Dark Palm,Mercury 2-Tone Longline Bra- Dark Palm,in stock,new,78.00 USD,mercury-2-tone-longline-bra-dark-palm,https://cdn.shoplightspeed.com/shops/651012/files/70036372/screenshot-2025-04-30-at-121552pm.png,,66883905
66856246,Classic Stretch Selvage- Chambray/Navy Stripe,Classic Stretch Selvage- Chambray/Navy Stripe,in stock,new,118.00 USD,classic-stretch-selvage-chambray-navy-stripe,https://cdn.shoplightspeed.com/shops/651012/files/70002540/screenshot-2025-04-28-at-30224pm.png,,66856246
66855879,Better-Than-Linen Shirt- White,Better-Than-Linen Shirt- White,in stock,new,138.00 USD,better-than-linen-shirt-white,https://cdn.shoplightspeed.com/shops/651012/files/70002189/screenshot-2025-04-28-at-25334pm.png,,66855879
66855745,Classic Stretch Selvage Shirt- Aqua Agave Print,Classic Stretch Selvage Shirt- Aqua Agave Print,in stock,new,118.00 USD,classic-stretch-selvage-shirt-aqua-agave-print,https://cdn.shoplightspeed.com/shops/651012/files/70052769/screenshot-2025-04-28-at-24805pm.png,,66855745
66855644,Better-Than-Linen Shirt- Salmon,Better-Than-Linen Shirt- Salmon,in stock,new,118.00 USD,better-than-linen-shirt-salmon,https://cdn.shoplightspeed.com/shops/651012/files/70001948/screenshot-2025-04-28-at-24506pm.png,,66855644
66836142,Spacedye Caught In The Midi HW Legging- Candy Apple Red Heat,Spacedye Caught In The Midi HW Legging- Candy Apple Red Heat,in stock,new,97.00 USD,spacedye-caught-in-the-midi-hw-legging-candy-apple,https://cdn.shoplightspeed.com/shops/651012/files/69963798/screenshot-2025-04-25-at-15201pm.png,,66836142
66835981,Spacedye Step Up Racerback Tank- Cloud White,Spacedye Step Up Racerback Tank- Cloud White,in stock,new,70.00 USD,spacedye-step-up-racerback-cloud-white,https://cdn.shoplightspeed.com/shops/651012/files/69963534/sd4002-cloud-white-0-a21da2d4-6524-4682-9ba7-e5f69.webp,,66835981
66835769,Spacedye Step Up Racerback Tank- Darkest Night,Spacedye Step Up Racerback Tank- Darkest Night,in stock,new,70.00 USD,spacedye-step-up-racerback-tank-darkest-night,https://cdn.shoplightspeed.com/shops/651012/files/69963180/sd4002-darkest-night-7398.webp,,66835769
66768650,Carnaby Pari Zip Knit Jacket- White,Carnaby Pari Zip Knit Jacket- White,out of stock,new,0.00 USD,carnaby-pari-zip-knit-jacket-white,,,66768650
66768627,One Love Club Coolum Crew- Sky,One Love Club Coolum Crew- Sky,in stock,new,139.99 USD,one-love-club-coolum-crew-sky,https://cdn.shoplightspeed.com/shops/651012/files/69843561/screenshot-2025-04-18-at-103750am.png,,66768627
66768608,Sonny V Neck Knit Sweater- White,Sonny V Neck Knit Sweater- White,in stock,new,159.99 USD,sonny-v-neck-knit-sweater-white,https://cdn.shoplightspeed.com/shops/651012/files/69843484/screenshot-2025-04-18-at-103152am.png,,66768608
67125839,Greyson Sweater Polo- White,Greyson Sweater Polo- White,in stock,new,118.00 USD,greyson-sweater-polo-white,https://cdn.shoplightspeed.com/shops/651012/files/70442904/screenshot-2025-05-24-at-120255pm.png,,67125839
67125816,Greyson Sweater Polo- India Ink,Greyson Sweater Polo- India Ink,in stock,new,118.00 USD,greyson-sweater-polo-india-ink,https://cdn.shoplightspeed.com/shops/651012/files/70442864/screenshot-2025-05-24-at-115925am.png,,67125816
67125727,Coastline Knit Shirt- Hidden Lake Plaid,Coastline Knit Shirt- Hidden Lake Plaid,out of stock,new,168.00 USD,coastline-knit-shirt-hidden-lake-plaid,https://cdn.shoplightspeed.com/shops/651012/files/70442714/screenshot-2025-05-24-at-114832am.png,,67125727
67125679,SS Palma Linen Camp Shirt- Sienna Valley Stripe,SS Palma Linen Camp Shirt- Sienna Valley Stripe,out of stock,new,168.00 USD,ss-palma-linen-camp-shirt-sienna-valley-stripe,https://cdn.shoplightspeed.com/shops/651012/files/70442628/screenshot-2025-05-24-at-114128am.png,,67125679
67125523,SS Breeze Shirt- Stormy Sea Floral,SS Breeze Shirt- Stormy Sea Floral,out of stock,new,158.00 USD,ss-breeze-shirt-stormy-sea-floral,https://cdn.shoplightspeed.com/shops/651012/files/70442315/screenshot-2025-05-24-at-105700am.png,,67125523
67125420,Supima Oxford Shirt- Pure White,Supima Oxford Shirt- Pure White,out of stock,new,128.00 USD,supima-oxford-shirt-pure-white,https://cdn.shoplightspeed.com/shops/651012/files/70442063/screenshot-2025-05-24-at-105116am.png,,67125420
67125392,SS Movement Shirt- Horizon Bloom,SS Movement Shirt- Horizon Bloom,out of stock,new,148.00 USD,ss-movement-shirt-horizon-bloom,https://cdn.shoplightspeed.com/shops/651012/files/70441998/screenshot-2025-05-24-at-104800am.png,,67125392
67125381,The Movement Shirt- Verona Island Plaid,The Movement Shirt- Verona Island Plaid,out of stock,new,158.00 USD,the-movement-shirt-verona-island-plaid,https://cdn.shoplightspeed.com/shops/651012/files/70441973/screenshot-2025-05-24-at-104318am.png,,67125381
67116037,Revolver Jade Racerback Bra- Black,Revolver Jade Racerback Bra- Black,in stock,new,89.99 USD,revolver-jade-racerback-bra-black,https://cdn.shoplightspeed.com/shops/651012/files/70424326/screenshot-2025-04-17-at-91339am.png,,67116037
67116036,Revolver 25IN Midi Pant- Black,Revolver 25IN Midi Pant- Black,in stock,new,119.99 USD,revolver-25in-midi-pant-black,https://cdn.shoplightspeed.com/shops/651012/files/70424320/screenshot-2025-04-17-at-90853am.png,,67116036
67100754,SS Sunwashed Henley- White,SS Sunwashed Henley- White,out of stock,new,78.00 USD,ss-sunwashed-henley-white,https://cdn.shoplightspeed.com/shops/651012/files/70390616/screenshot-2025-05-21-at-32641pm.png,,67100754
67100523,Routine Ribbed Biker Jumpsuit- Black Onyx,Routine Ribbed Biker Jumpsuit- Black Onyx,out of stock,new,108.00 USD,routine-ribber-biker-jumpsuit-black-onyx,https://cdn.shoplightspeed.com/shops/651012/files/70389967/screenshot-2025-05-21-at-31727pm.png,,67100523
67098872,Studio Siren Pant- Heather Grey,Studio Siren Pant- Heather Grey,in stock,new,108.00 USD,studio-siren-pant-heather-grey,https://cdn.shoplightspeed.com/shops/651012/files/70385412/screenshot-2025-05-21-at-20927pm.png,,67098872
67098393,All Clear Cami- Seafoam,All Clear Cami- Seafoam,in stock,new,30.00 USD,all-clear-cami-seafoam,https://cdn.shoplightspeed.com/shops/651012/files/70384412/screenshot-2025-05-21-at-14546pm.png,,67098393
67098064,Gym Sock- Blue Sunset Stripe,Gym Sock- Blue Sunset Stripe,in stock,new,15.00 USD,gym-sock-blue-sunset-stripe,https://cdn.shoplightspeed.com/shops/651012/files/70384047/screenshot-2025-05-21-at-13843pm.png,,67098064
67098018,"Saturday Seersucker Short 6""- Light Indigo","Saturday Seersucker Short 6""- Light Indigo",in stock,new,98.00 USD,saturday-seersucker-short-6-light-indigo,https://cdn.shoplightspeed.com/shops/651012/files/70383912/screenshot-2025-05-21-at-13420pm.png,,67098018
67097967,Air Pocket Polo- Withered Rose,Air Pocket Polo- Withered Rose,in stock,new,88.00 USD,air-pocket-polo-withered-rose,https://cdn.shoplightspeed.com/shops/651012/files/70383770/screenshot-2025-05-21-at-13228pm.png,,67097967
67093362,Stretch Terry 5Pocket - Desert Khaki,Stretch Terry 5Pocket- Desert Khaki,out of stock,new,178.00 USD,stretch-terry-5pocket-desert-khaki,https://cdn.shoplightspeed.com/shops/651012/files/70405550/terrypocket5.webp,,67093362
67087529,Airweight Bra With Ruching- White,Airweight Bra With Ruching- White,in stock,new,88.00 USD,airweight-bra-with-ruching-white,https://cdn.shoplightspeed.com/shops/651012/files/70368703/screenshot-2025-05-20-at-81307pm.png,,67087529
67087474,Austin Rigor Dress- White/Indigo,Austin Rigor Dress- White/Indigo,in stock,new,168.00 USD,austin-rigor-dress-white-indigo,https://cdn.shoplightspeed.com/shops/651012/files/70368651/screenshot-2025-05-20-at-81023pm.png,,67087474
67087385,Airweight Bomber Jacket- White,Airweight Bomber Jacket- White,in stock,new,158.00 USD,airweight-bomber-jacket-white,https://cdn.shoplightspeed.com/shops/651012/files/70368612/screenshot-2025-05-20-at-80938pm.png,,67087385
67086787,Miles High Waist Rigor 7/8- Skylight/White,Miles High Waist Rigor 7/8- Skylight/White,in stock,new,138.00 USD,miles-high-waist-rigor-7-8-skylight-white,https://cdn.shoplightspeed.com/shops/651012/files/70368292/screenshot-2025-05-20-at-74140pm.png,,67086787
67086721,Miles Rigor Bra- Skylight/White,Miles Rigor Bra- Skylight/White,in stock,new,82.00 USD,miles-rigor-bra-skylight-white,https://cdn.shoplightspeed.com/shops/651012/files/70368250/screenshot-2025-05-20-at-73948pm.png,,67086721
67073467,Spritz Vintage Cap- Navy,Spritz Vintage Cap- Navy,in stock,new,47.00 USD,spritz-vintage-cap-navy,https://cdn.shoplightspeed.com/shops/651012/files/70348753/screenshot-2025-05-19-at-84432pm.png,,67073467
67073454,Not a Tourist Cap- White,Not a Tourist Cap- White,in stock,new,47.00 USD,not-a-tourist-cap-white,https://cdn.shoplightspeed.com/shops/651012/files/70348743/screenshot-2025-05-19-at-84021pm.png,,67073454
67073452,Negroni Please Cap- Spruce,Negroni Please Cap- Spruce,in stock,new,47.00 USD,negroni-please-cap-spruce,https://cdn.shoplightspeed.com/shops/651012/files/70348738/screenshot-2025-05-19-at-83657pm.png,,67073452
67073445,Jet Lagged Cap- Navy,Jet Lagged Cap- Navy,in stock,new,47.00 USD,jet-lagged-cap-navy,https://cdn.shoplightspeed.com/shops/651012/files/70348733/screenshot-2025-05-19-at-83657pm.png,,67073445
67073435,Champagne Problems Cap- Pink,Champagne Problems Cap- Pink,in stock,new,47.00 USD,champagne-problems-cap-pink,https://cdn.shoplightspeed.com/shops/651012/files/70348721/screenshot-2025-05-19-at-83429pm.png,,67073435
67073428,Late Check Out Cap- Black,Late Check Out Cap- Black,in stock,new,46.00 USD,late-check-out-cap-black,https://cdn.shoplightspeed.com/shops/651012/files/70348710/screenshot-2025-05-19-at-83238pm.png,,67073428
67053767,Never Better Heather Crop- Blueberry Heather,Never Better Heather Crop- Blueberry Heather,in stock,new,34.80 USD,never-better-heather-crop-blueberry-heather,https://cdn.shoplightspeed.com/shops/651012/files/70308355/screen-shot-2024-12-11-at-125012-pm.png,,67053767
67046653,Angelina Skirt Crochet- Onyx,Angelina Skirt Crochet- Onyx,in stock,new,198.00 USD,angelina-skirt-crochet-onyx,https://cdn.shoplightspeed.com/shops/651012/files/70302061/screenshot-2025-05-15-at-95855pm.png,,67046653
67046601,Roberta Top- Crochet Onyx,Roberta Top- Crochet Onyx,in stock,new,158.00 USD,roberta-top-crochet-onyx,https://cdn.shoplightspeed.com/shops/651012/files/70302049/screenshot-2025-05-15-at-95557pm.png,,67046601
67046524,Weylan Dress- Onyx,Weylan Dress- Onyx,out of stock,new,138.00 USD,weylan-dress-onyx,https://cdn.shoplightspeed.com/shops/651012/files/70301994/screenshot-2025-05-15-at-95219pm.png,,67046524
67046412,Addison Dress- Onyx,Addison Dress- Onyx,out of stock,new,238.00 USD,addison-dress-onyx,https://cdn.shoplightspeed.com/shops/651012/files/70301923/screenshot-2025-05-15-at-94458pm.png,,67046412
67046356,Chloe Sweater- Royal,Chloe Sweater- Royal,in stock,new,158.00 USD,chloe-sweater-royal,https://cdn.shoplightspeed.com/shops/651012/files/70301884/screenshot-2025-05-15-at-93744pm.png,,67046356
66983604,Cluster B,Cluster B,out of stock,new,0.00 USD,cluster-b,,,66983604
66983475,Kirsi Half Zip Midlayer- White/Forest,Kirsi Half Zip Midlayer- White/Forest,in stock,new,138.00 USD,kirsi-half-zip-midlayer-white-forest,https://cdn.shoplightspeed.com/shops/651012/files/70307629/screenshot-2025-05-09-at-15156pm.png,,66983475
66982835,Ferns Open Knit Tank- Shadow,Ferns Open Knit Tank- Shadow,in stock,new,88.00 USD,ferns-open-knit-tank-shadow,https://cdn.shoplightspeed.com/shops/651012/files/70202922/screenshot-2025-05-09-at-14901pm.png,,66982835
66982795,Ferns Open Knit Tank- Snow White,Ferns Open Knit Tank- Snow White,in stock,new,88.00 USD,ferns-open-knit-tank-snow-white,https://cdn.shoplightspeed.com/shops/651012/files/70202836/screenshot-2025-05-09-at-14547pm.png,,66982795
66982750,Athena Pointelle Knit Vest- Egret,Athena Pointelle Knit Vest- Egret,in stock,new,110.00 USD,athena-pointelle-knit-vest-egret,https://cdn.shoplightspeed.com/shops/651012/files/70202715/screenshot-2025-05-09-at-14122pm.png,,66982750
66982708,Scott Scoop Neck Midi Dress- Birch,Scott Scoop Neck Midi Dress- Birch,in stock,new,178.00 USD,scott-scoop-neck-midi-dress-birch,https://cdn.shoplightspeed.com/shops/651012/files/70307601/screenshot-2025-05-09-at-13817pm.png,,66982708
66980223,Archive Tencel Linen Resort Shirt- Navy Happy Hour Print,Archive Tencel Linen Resort Shirt- Navy Happy Hour Print,out of stock,new,118.00 USD,archive-tencel-linen-resort-shirt-navy-happy-hour,https://cdn.shoplightspeed.com/shops/651012/files/70196260/screenshot-2025-05-09-at-95242am.png,,66980223
66980200,Greyson Sweater Polo- Topaz,Greyson Sweater Polo- Topaz,out of stock,new,118.00 USD,greyson-sweater-polo-topaz,https://cdn.shoplightspeed.com/shops/651012/files/70196205/screenshot-2025-05-09-at-94909am.png,,66980200
66980176,Archive Cyrus Sweater Polo- Natural,Archive Cyrus Sweater Polo- Natural,out of stock,new,128.00 USD,archive-cyrus-sweater-polo-natural,https://cdn.shoplightspeed.com/shops/651012/files/70196151/screenshot-2025-05-09-at-94555am.png,,66980176
66980136,Archive Cam Jacquard Resort Shirt- Neutral Geo,Archive Cam Jacquard Resort Shirt- Neutral Geo,out of stock,new,108.00 USD,archive-cam-jacquard-resort-shirt-neutral-geo,https://cdn.shoplightspeed.com/shops/651012/files/70196085/screenshot-2025-05-09-at-94313am.png,,66980136
66980114,Mabel Shirt- Strawberry Stand Terry,Mabel Shirt- Strawberry Stand Terry,in stock,new,98.00 USD,mabel-shirt-strawberry-stand-terry,https://cdn.shoplightspeed.com/shops/651012/files/70196036/screenshot-2025-05-09-at-93706am.png,,66980114
66980102,Kiara Short- Strawberry Stand Terry,Kiara Short- Strawberry Stand Terry,in stock,new,88.00 USD,kiara-short-strawberry-stand-terry,https://cdn.shoplightspeed.com/shops/651012/files/70195991/screenshot-2025-05-09-at-93706am.png,,66980102
66980071,Camilla Top  & Highway Bottom Set- Strawberry Stand Terry,Camilla Top  & Highway Bottom Set- Strawberry Stand Terry,in stock,new,206.00 USD,camilla-top-highway-bottom-set-strawberry-stand-te,https://cdn.shoplightspeed.com/shops/651012/files/70195933/screenshot-2025-05-09-at-92808am.png,,66980071
66980039,Priscilla One Piece- Fruit Market,Priscilla One Piece- Fruit Market,in stock,new,0.00 USD,priscilla-one-piece-fruit-market,https://cdn.shoplightspeed.com/shops/651012/files/70195844/screenshot-2025-05-09-at-92544am.png,,66980039
66980017,Righteous Runsie- Clove,Righteous Runsie- Clove,in stock,new,0.00 USD,righteous-runsie-clove,https://cdn.shoplightspeed.com/shops/651012/files/70195800/screenshot-2025-05-09-at-92151am.png,,66980017
66946838,Phoebe Bikini- Black,Phoebe Bikini- Black,in stock,new,0.00 USD,phoebe-bikini-black,https://cdn.shoplightspeed.com/shops/651012/files/70149926/screenshot-2025-05-07-at-81949am.png,,66946838
66946837,Osiris Frill Bikini- Navy,Osiris Frill Bikini- Navy,in stock,new,0.00 USD,osiris-frill-bikini-navy,https://cdn.shoplightspeed.com/shops/651012/files/70149920/screenshot-2025-05-07-at-81729am.png,,66946837
66946833,Domino Swim- Metallic Cocoa,Domino Swim- Metallic Cocoa,in stock,new,0.00 USD,domino-swim-metallic-cocoa,https://cdn.shoplightspeed.com/shops/651012/files/70149914/screenshot-2025-05-07-at-81559am.png,,66946833
66946830,Camille Swim- Metallic Kahki,Camille Swim- Metallic Kahki,in stock,new,0.00 USD,camille-swim-metallic-kahki,https://cdn.shoplightspeed.com/shops/651012/files/70149896/screenshot-2025-05-07-at-81259am.png,,66946830
66946828,Camille Swim- Metallic Rosewood,Camille Swim- Metallic Rosewood,in stock,new,0.00 USD,camille-swim-metallic-rosewood,https://cdn.shoplightspeed.com/shops/651012/files/70149890/screenshot-2025-05-07-at-81006am.png,,66946828
66946824,Square Neck Swim- Metallic Cocoa,Square Neck Swim- Metallic Cocoa,in stock,new,0.00 USD,square-neck-swim-metallic-cocoa,https://cdn.shoplightspeed.com/shops/651012/files/70149857/screenshot-2025-05-07-at-80644am.png,,66946824
66946817,Domino Swim- Blush,Domino Swim- Blush,in stock,new,0.00 USD,domino-swim-blush,https://cdn.shoplightspeed.com/shops/651012/files/70149840/screenshot-2025-05-07-at-80339am.png,,66946817
66946811,Camille One Piece- Red,Camille One Piece- Red,in stock,new,0.00 USD,camille-one-piece-red,https://cdn.shoplightspeed.com/shops/651012/files/70149812/screenshot-2025-05-07-at-75806am.png,,66946811
66931094,Jolie Hoodie- Ivory,Jolie Hoodie- Ivory,in stock,new,0.00 USD,jolie-hoodie-ivory,https://cdn.shoplightspeed.com/shops/651012/files/70123175/screenshot-2025-04-16-at-44338pm.png,,66931094
66931082,Polo Sweater- Lavender,Polo Sweater- Lavender,out of stock,new,0.00 USD,polo-sweater-lavender,https://cdn.shoplightspeed.com/shops/651012/files/70123167/screenshot-2025-04-16-at-44848pm.png,,66931082
66931055,Easy Pant- Indigo Stripe,Easy Pant- Indigo Stripe,in stock,new,0.00 USD,easy-pant-indigo-stripe,https://cdn.shoplightspeed.com/shops/651012/files/70123149/screenshot-2025-04-16-at-44527pm.png,,66931055
66931003,Classic Sweatshirt-Peace Out- Apricot,Classic Sweatshirt-Peace Out- Apricot,in stock,new,0.00 USD,classic-sweatshirt-peace-out-apricot,https://cdn.shoplightspeed.com/shops/651012/files/70123098/screenshot-2025-04-16-at-43841pm.png,,66931003
66911071,Bathing Suit- Shark Kings,Bathing Suit- Shark Kings,in stock,new,0.00 USD,bathing-suit-shark-kings,https://cdn.shoplightspeed.com/shops/651012/files/70085149/screenshot-2025-05-02-at-35837pm.png,,66911071
66910842,"Khaki Shorts 7""- April Big Cannons","Khaki Shorts 7""- April Big Cannons",in stock,new,0.00 USD,khaki-shorts-7-april-big-cannons,https://cdn.shoplightspeed.com/shops/651012/files/70084819/screenshot-2025-05-02-at-34933pm.png,,66910842
66910585,"Khaki Shorts 7""- Buzz Lightbeer","Khaki Shorts 7""- Buzz Lightbeer",in stock,new,0.00 USD,khaki-shorts-buzz-lightbeer,https://cdn.shoplightspeed.com/shops/651012/files/70084570/screenshot-2025-05-02-at-34245pm.png,,66910585
66905986,Spacedye Slim Racerback Crop Tank,Spacedye Slim Racerback Crop Tank,in stock,new,0.00 USD,spacedye-slim-racerback-crop-tank,https://cdn.shoplightspeed.com/shops/651012/files/70077821/sd4382-candy-apple-red-heather-07416.webp,,66905986
66905810,Spacedye On The Up Crop Tank,Spacedye On The Up Crop Tank,in stock,new,0.00 USD,spacedye-on-the-up-crop-tank,https://cdn.shoplightspeed.com/shops/651012/files/70077455/sd4712-darkest-night-16036.webp,,66905810
66905739,Spacedye Starting Line Dress- Darkest Night,Spacedye Starting Line Dress- Darkest Night,in stock,new,0.00 USD,spacedye-starting-line-dress-darkest-night,https://cdn.shoplightspeed.com/shops/651012/files/70077341/sd6283-darkest-night-cloud-white-4399.webp,,66905739
66894819,movement quarter zip- blue nights,movement quarter zip- blue nights,in stock,new,0.00 USD,movement-quarter-zip-blue-nights,https://cdn.shoplightspeed.com/shops/651012/files/70056764/screen-shot-2024-05-28-at-92816-pm.png,,66894819
66894814,"belt loop all day shorts (5"")- ice grey","belt loop all day shorts (5"")- ice grey",in stock,new,0.00 USD,belt-loop-all-day-shorts-5-ice-grey,https://cdn.shoplightspeed.com/shops/651012/files/70056757/screen-shot-2024-06-12-at-70349-pm.png,,66894814
